Date,Time,Out_Temp,Out_Hum,Wind_Speed,Rain,Solar_Rad,Date_time,DOY
29/12/04,6:00 pm,27.2,0.56,0,0,10.49688,2004-12-29 18:00:00,364
29/12/04,7:00 pm,26.7,0.58,0,0,2.92536,2004-12-29 19:00:00,364
29/12/04,8:00 pm,26.9,0.59,0,0,0,2004-12-29 20:00:00,364
29/12/04,9:00 pm,26.6,0.61,0,0,0,2004-12-29 21:00:00,364
29/12/04,10:00 pm,25.1,0.64,0,0,0,2004-12-29 22:00:00,364
29/12/04,11:00 pm,24.9,0.64,0,0,0,2004-12-29 23:00:00,364
30/12/04,12:00 am,24.7,0.66,0,0,0,2004-12-30 00:00:00,365
30/12/04,1:00 am,24.2,0.69,0,0,0,2004-12-30 01:00:00,365
30/12/04,2:00 am,23.7,0.68,0,0,0,2004-12-30 02:00:00,365
30/12/04,3:00 am,23.3,0.69,0,0,0,2004-12-30 03:00:00,365
30/12/04,4:00 am,23,0.69,0,0,0,2004-12-30 04:00:00,365
30/12/04,5:00 am,22.6,0.7,0,0,0,2004-12-30 05:00:00,365
30/12/04,6:00 am,22.3,0.71,0,0,0,2004-12-30 06:00:00,365
30/12/04,7:00 am,20,0.92,1.6,0,1.46268,2004-12-30 07:00:00,365
30/12/04,8:00 am,20.8,0.84,0,0,18.32652,2004-12-30 08:00:00,365
30/12/04,9:00 am,23,0.77,3.2,0,40.18068,2004-12-30 09:00:00,365
30/12/04,10:00 am,25.1,0.68,4.8,0,59.3676,2004-12-30 10:00:00,365
30/12/04,11:00 am,26.9,0.63,1.6,0,75.02688,2004-12-30 11:00:00,365
30/12/04,12:00 pm,28.1,0.51,3.2,0,86.12604,2004-12-30 12:00:00,365
30/12/04,1:00 pm,29.3,0.56,4.8,0,96.88104,2004-12-30 13:00:00,365
30/12/04,2:00 pm,29.9,0.52,6.4,0,98.85996,2004-12-30 14:00:00,365
30/12/04,3:00 pm,30.7,0.48,6.4,0,93.09528,2004-12-30 15:00:00,365
30/12/04,4:00 pm,31.1,0.46,6.4,0,81.65196,2004-12-30 16:00:00,365
30/12/04,5:00 pm,31.4,0.47,4.8,0,66.76704,2004-12-30 17:00:00,365
30/12/04,6:00 pm,31.3,0.5,4.8,0,46.63368,2004-12-30 18:00:00,365
30/12/04,7:00 pm,30.6,0.57,4.8,0,28.65132,2004-12-30 19:00:00,365
30/12/04,8:00 pm,28.1,0.72,3.2,0,9.63648,2004-12-30 20:00:00,365
30/12/04,9:00 pm,23.7,0.81,3.2,0,0.4302,2004-12-30 21:00:00,365
30/12/04,10:00 pm,21.3,0.85,1.6,0,0,2004-12-30 22:00:00,365
30/12/04,11:00 pm,20.6,0.86,0,0,0,2004-12-30 23:00:00,365
31/12/04,12:00 am,19.6,0.89,0,0,0,2004-12-31 00:00:00,366
31/12/04,1:00 am,19.4,0.88,0,0,0,2004-12-31 01:00:00,366
31/12/04,2:00 am,19.1,0.93,0,0,0,2004-12-31 02:00:00,366
31/12/04,3:00 am,18.5,0.92,0,0,0,2004-12-31 03:00:00,366
31/12/04,4:00 am,18.3,0.9,0,0,0,2004-12-31 04:00:00,366
31/12/04,5:00 am,17.1,0.92,0,0,0,2004-12-31 05:00:00,366
31/12/04,6:00 am,17.3,0.9,0,0,0,2004-12-31 06:00:00,366
31/12/04,7:00 am,18,0.89,0,0,3.8718,2004-12-31 07:00:00,366
31/12/04,8:00 am,22.3,0.81,3.2,0,20.04732,2004-12-31 08:00:00,366
31/12/04,9:00 am,26,0.69,6.4,0,39.5784,2004-12-31 09:00:00,366
31/12/04,10:00 am,29.1,0.6,9.7,0,57.81888,2004-12-31 10:00:00,366
31/12/04,11:00 am,30.8,0.5,9.7,0,73.04796,2004-12-31 11:00:00,366
31/12/04,12:00 pm,31.9,0.46,11.3,0,84.66336,2004-12-31 12:00:00,366
31/12/04,1:00 pm,32.9,0.44,11.3,0,92.0628,2004-12-31 13:00:00,366
31/12/04,2:00 pm,33.2,0.46,11.3,0,87.67476,2004-12-31 14:00:00,366
31/12/04,3:00 pm,34.1,0.46,11.3,0,93.3534,2004-12-31 15:00:00,366
31/12/04,4:00 pm,34.1,0.43,12.9,0,80.10324,2004-12-31 16:00:00,366
31/12/04,5:00 pm,34,0.44,12.9,0,65.73456,2004-12-31 17:00:00,366
31/12/04,6:00 pm,33.2,0.45,11.3,0,42.93396,2004-12-31 18:00:00,366
31/12/04,7:00 pm,32.6,0.49,9.7,0,27.36072,2004-12-31 19:00:00,366
31/12/04,8:00 pm,30.8,0.62,6.4,0,10.15272,2004-12-31 20:00:00,366
31/12/04,9:00 pm,26.8,0.73,1.6,0,0.25812,2004-12-31 21:00:00,366
31/12/04,10:00 pm,24.8,0.8,0,0,0,2004-12-31 22:00:00,366
31/12/04,11:00 pm,24,0.82,1.6,0,0,2004-12-31 23:00:00,366
01/01/05,12:00 am,23.4,0.85,3.2,0,0,2005-01-01 00:00:00,1
01/01/05,1:00 am,23.3,0.84,1.6,0,0,2005-01-01 01:00:00,1
01/01/05,2:00 am,23.3,0.85,0,0,0,2005-01-01 02:00:00,1
01/01/05,3:00 am,22.9,0.84,3.2,0,0,2005-01-01 03:00:00,1
01/01/05,4:00 am,22.7,0.88,3.2,0,0,2005-01-01 04:00:00,1
01/01/05,5:00 am,22.6,0.86,1.6,0,0,2005-01-01 05:00:00,1
01/01/05,6:00 am,22.6,0.86,0,0,0,2005-01-01 06:00:00,1
01/01/05,7:00 am,22.4,0.81,3.2,0,1.54872,2005-01-01 07:00:00,1
01/01/05,8:00 am,23.4,0.76,6.4,0,8.00172,2005-01-01 08:00:00,1
01/01/05,9:00 am,25.1,0.71,8,0,16.43364,2005-01-01 09:00:00,1
01/01/05,10:00 am,26.3,0.71,8,0,21.0798,2005-01-01 10:00:00,1
01/01/05,11:00 am,26.9,0.69,8,0,22.71456,2005-01-01 11:00:00,1
01/01/05,12:00 pm,26.7,0.75,6.4,0,11.70144,2005-01-01 12:00:00,1
01/01/05,1:00 pm,25.7,0.71,4.8,0,4.64616,2005-01-01 13:00:00,1
01/01/05,2:00 pm,25.1,0.75,4.8,0,3.0114,2005-01-01 14:00:00,1
01/01/05,3:00 pm,23.7,0.93,14.5,0.737,1.37664,2005-01-01 15:00:00,1
01/01/05,4:00 pm,21.1,0.94,12.9,0.94,1.11852,2005-01-01 16:00:00,1
01/01/05,5:00 pm,21,0.93,1.6,1.727,1.11852,2005-01-01 17:00:00,1
01/01/05,6:00 pm,20.8,0.94,3.2,0.406,2.49516,2005-01-01 18:00:00,1
01/01/05,7:00 pm,21.1,0.87,12.9,0.025,5.93676,2005-01-01 19:00:00,1
01/01/05,8:00 pm,21.6,0.87,14.5,0,7.05528,2005-01-01 20:00:00,1
01/01/05,9:00 pm,20.8,0.89,6.4,0,1.46268,2005-01-01 21:00:00,1
01/01/05,10:00 pm,19.2,0.92,1.6,0,0,2005-01-01 22:00:00,1
01/01/05,11:00 pm,18.9,0.92,3.2,0,0,2005-01-01 23:00:00,1
02/01/05,12:00 am,19.3,0.9,3.2,0,0,2005-01-02 00:00:00,2
02/01/05,1:00 am,19,0.93,1.6,0,0,2005-01-02 01:00:00,2
02/01/05,2:00 am,18.8,0.93,1.6,0,0,2005-01-02 02:00:00,2
02/01/05,3:00 am,17.9,0.94,1.6,0,0,2005-01-02 03:00:00,2
02/01/05,4:00 am,17.8,0.95,0,0,0,2005-01-02 04:00:00,2
02/01/05,5:00 am,18,0.94,0,0,0,2005-01-02 05:00:00,2
02/01/05,6:00 am,18.3,0.95,1.6,0,0,2005-01-02 06:00:00,2
02/01/05,7:00 am,18.9,0.95,1.6,0,1.63476,2005-01-02 07:00:00,2
02/01/05,8:00 am,20.4,0.89,1.6,0,12.64788,2005-01-02 08:00:00,2
02/01/05,9:00 am,24.1,0.8,4.8,0,36.39492,2005-01-02 09:00:00,2
02/01/05,10:00 am,26.6,0.67,8,0,57.6468,2005-01-02 10:00:00,2
02/01/05,11:00 am,27.9,0.71,4.8,0,73.82232,2005-01-02 11:00:00,2
02/01/05,12:00 pm,29,0.62,1.6,0,84.66336,2005-01-02 12:00:00,2
02/01/05,1:00 pm,30,0.59,1.6,0,91.37448,2005-01-02 13:00:00,2
02/01/05,2:00 pm,30.6,0.57,1.6,0,93.09528,2005-01-02 14:00:00,2
02/01/05,3:00 pm,31.1,0.57,3.2,0,89.30952,2005-01-02 15:00:00,2
02/01/05,4:00 pm,31.1,0.53,3.2,0,78.98472,2005-01-02 16:00:00,2
02/01/05,5:00 pm,31.6,0.51,1.6,0,65.56248,2005-01-02 17:00:00,2
02/01/05,6:00 pm,32.4,0.51,1.6,0,48.09636,2005-01-02 18:00:00,2
02/01/05,7:00 pm,30.3,0.64,0,0,15.57324,2005-01-02 19:00:00,2
02/01/05,8:00 pm,32.3,0.6,0,0,12.906,2005-01-02 20:00:00,2
02/01/05,9:00 pm,28.4,0.76,0,0,0.4302,2005-01-02 21:00:00,2
02/01/05,10:00 pm,25.3,0.82,0,0,0,2005-01-02 22:00:00,2
02/01/05,11:00 pm,24.6,0.84,1.6,0,0,2005-01-02 23:00:00,2
03/01/05,12:00 am,23.7,0.87,0,0,0,2005-01-03 00:00:00,3
03/01/05,1:00 am,22.3,0.92,0,0,0,2005-01-03 01:00:00,3
03/01/05,2:00 am,22.1,0.92,0,0,0,2005-01-03 02:00:00,3
03/01/05,3:00 am,21.5,0.93,0,0,0,2005-01-03 03:00:00,3
03/01/05,4:00 am,21.5,0.93,0,0,0,2005-01-03 04:00:00,3
03/01/05,5:00 am,21.3,0.93,0,0,0,2005-01-03 05:00:00,3
03/01/05,6:00 am,20.9,0.93,0,0,0,2005-01-03 06:00:00,3
03/01/05,7:00 am,21.3,0.9,0,0,3.09744,2005-01-03 07:00:00,3
03/01/05,8:00 am,24.3,0.86,0,0,16.60572,2005-01-03 08:00:00,3
03/01/05,9:00 am,27.4,0.74,1.6,0,37.77156,2005-01-03 09:00:00,3
03/01/05,10:00 am,29.4,0.71,4.8,0,56.27016,2005-01-03 10:00:00,3
03/01/05,11:00 am,30.9,0.66,1.6,0,67.36932,2005-01-03 11:00:00,3
03/01/05,12:00 pm,32.3,0.61,1.6,0,90.68616,2005-01-03 12:00:00,3
03/01/05,1:00 pm,29.9,0.81,6.4,0.406,29.76984,2005-01-03 13:00:00,3
03/01/05,2:00 pm,25.1,0.77,8,0,16.26156,2005-01-03 14:00:00,3
03/01/05,3:00 pm,28.7,0.71,4.8,0,89.30952,2005-01-03 15:00:00,3
03/01/05,4:00 pm,30.7,0.69,4.8,0,78.81264,2005-01-03 16:00:00,3
03/01/05,5:00 pm,31.3,0.66,8,0,64.9602,2005-01-03 17:00:00,3
03/01/05,6:00 pm,31.3,0.68,6.4,0,47.83824,2005-01-03 18:00:00,3
03/01/05,7:00 pm,31.1,0.65,4.8,0,28.90944,2005-01-03 19:00:00,3
03/01/05,8:00 pm,29.9,0.78,3.2,0,10.15272,2005-01-03 20:00:00,3
03/01/05,9:00 pm,26.2,0.85,3.2,0,0.4302,2005-01-03 21:00:00,3
03/01/05,10:00 pm,24.4,0.88,1.6,0,0,2005-01-03 22:00:00,3
03/01/05,11:00 pm,23.9,0.89,3.2,0,0,2005-01-03 23:00:00,3
04/01/05,12:00 am,24.1,0.89,1.6,0,0,2005-01-04 00:00:00,4
04/01/05,1:00 am,23.8,0.85,1.6,0,0,2005-01-04 01:00:00,4
04/01/05,2:00 am,23.9,0.86,3.2,0,0,2005-01-04 02:00:00,4
04/01/05,3:00 am,22.6,0.89,1.6,0,0,2005-01-04 03:00:00,4
04/01/05,4:00 am,21.2,0.91,1.6,0,0,2005-01-04 04:00:00,4
04/01/05,5:00 am,20.1,0.92,0,0,0,2005-01-04 05:00:00,4
04/01/05,6:00 am,19.6,0.92,0,0,0,2005-01-04 06:00:00,4
04/01/05,7:00 am,19.9,0.9,0,0,3.09744,2005-01-04 07:00:00,4
04/01/05,8:00 am,23.6,0.76,0,0,20.04732,2005-01-04 08:00:00,4
04/01/05,9:00 am,26.8,0.77,3.2,0,38.11572,2005-01-04 09:00:00,4
04/01/05,10:00 am,28.8,0.61,3.2,0,57.6468,2005-01-04 10:00:00,4
04/01/05,11:00 am,30.9,0.55,1.6,0,73.73628,2005-01-04 11:00:00,4
04/01/05,12:00 pm,32.1,0.56,3.2,0,85.52376,2005-01-04 12:00:00,4
04/01/05,1:00 pm,32.9,0.5,1.6,0,92.40696,2005-01-04 13:00:00,4
04/01/05,2:00 pm,33.7,0.57,1.6,0,93.09528,2005-01-04 14:00:00,4
04/01/05,3:00 pm,34.6,0.34,1.6,0,89.22348,2005-01-04 15:00:00,4
04/01/05,4:00 pm,35.6,0.44,0,0,79.50096,2005-01-04 16:00:00,4
04/01/05,5:00 pm,35.1,0.46,1.6,0,65.13228,2005-01-04 17:00:00,4
04/01/05,6:00 pm,34.2,0.56,3.2,0,47.66616,2005-01-04 18:00:00,4
04/01/05,7:00 pm,32.6,0.64,4.8,0,28.3932,2005-01-04 19:00:00,4
04/01/05,8:00 pm,30.9,0.71,1.6,0,10.15272,2005-01-04 20:00:00,4
04/01/05,9:00 pm,28,0.79,1.6,0,0.4302,2005-01-04 21:00:00,4
04/01/05,10:00 pm,26.1,0.86,0,0,0,2005-01-04 22:00:00,4
04/01/05,11:00 pm,25.6,0.86,0,0,0,2005-01-04 23:00:00,4
05/01/05,12:00 am,24.8,0.88,0,0,0,2005-01-05 00:00:00,5
05/01/05,1:00 am,23.9,0.9,1.6,0,0,2005-01-05 01:00:00,5
05/01/05,2:00 am,23.3,0.88,0,0,0,2005-01-05 02:00:00,5
05/01/05,3:00 am,22.9,0.9,1.6,0,0,2005-01-05 03:00:00,5
05/01/05,4:00 am,22.4,0.92,0,0,0,2005-01-05 04:00:00,5
05/01/05,5:00 am,22.1,0.91,1.6,0,0,2005-01-05 05:00:00,5
05/01/05,6:00 am,22.1,0.91,1.6,0,0,2005-01-05 06:00:00,5
05/01/05,7:00 am,21.7,0.89,0,0,3.0114,2005-01-05 07:00:00,5
05/01/05,8:00 am,24.7,0.82,0,0,19.10088,2005-01-05 08:00:00,5
05/01/05,9:00 am,28.9,0.73,1.6,0,43.10604,2005-01-05 09:00:00,5
05/01/05,10:00 am,31.6,0.56,0,0,59.96988,2005-01-05 10:00:00,5
05/01/05,11:00 am,33.1,0.53,4.8,0,71.75736,2005-01-05 11:00:00,5
05/01/05,12:00 pm,32.9,0.51,6.4,0,76.48956,2005-01-05 12:00:00,5
05/01/05,1:00 pm,33.6,0.53,8,0,97.48332,2005-01-05 13:00:00,5
05/01/05,2:00 pm,33.7,0.47,8,0,86.9004,2005-01-05 14:00:00,5
05/01/05,3:00 pm,33.9,0.56,8,0,89.0514,2005-01-05 15:00:00,5
05/01/05,4:00 pm,34.3,0.53,6.4,0,79.41492,2005-01-05 16:00:00,5
05/01/05,5:00 pm,34.6,0.47,4.8,0,66.681,2005-01-05 17:00:00,5
05/01/05,6:00 pm,35.1,0.55,3.2,0,48.78468,2005-01-05 18:00:00,5
05/01/05,7:00 pm,33.8,0.67,1.6,0,28.65132,2005-01-05 19:00:00,5
05/01/05,8:00 pm,31.7,0.68,1.6,0,9.63648,2005-01-05 20:00:00,5
05/01/05,9:00 pm,28.1,0.76,1.6,0,0.4302,2005-01-05 21:00:00,5
05/01/05,10:00 pm,25.6,0.87,1.6,0,0,2005-01-05 22:00:00,5
05/01/05,11:00 pm,24.1,0.84,1.6,0,0,2005-01-05 23:00:00,5
06/01/05,12:00 am,23.7,0.85,1.6,0,0,2005-01-06 00:00:00,6
06/01/05,1:00 am,23.6,0.85,1.6,0,0,2005-01-06 01:00:00,6
06/01/05,2:00 am,22.5,0.82,0,0,0,2005-01-06 02:00:00,6
06/01/05,3:00 am,22.4,0.86,1.6,0,0,2005-01-06 03:00:00,6
06/01/05,4:00 am,21.7,0.88,1.6,0,0,2005-01-06 04:00:00,6
06/01/05,5:00 am,21.4,0.9,1.6,0,0,2005-01-06 05:00:00,6
06/01/05,6:00 am,20.3,0.91,0,0,0,2005-01-06 06:00:00,6
06/01/05,7:00 am,20.8,0.88,0,0,3.0114,2005-01-06 07:00:00,6
06/01/05,8:00 am,25.1,0.78,0,0,16.94988,2005-01-06 08:00:00,6
06/01/05,9:00 am,29.3,0.72,1.6,0,38.2878,2005-01-06 09:00:00,6
06/01/05,10:00 am,30.4,0.58,3.2,0,53.43084,2005-01-06 10:00:00,6
06/01/05,11:00 am,33,0.53,1.6,0,73.134,2005-01-06 11:00:00,6
06/01/05,12:00 pm,33.9,0.54,1.6,0,85.43772,2005-01-06 12:00:00,6
06/01/05,1:00 pm,31.7,0.68,12.9,0,53.94708,2005-01-06 13:00:00,6
06/01/05,2:00 pm,32.2,0.61,12.9,0,93.69756,2005-01-06 14:00:00,6
06/01/05,3:00 pm,32.8,0.6,11.3,0,86.29812,2005-01-06 15:00:00,6
06/01/05,4:00 pm,33.3,0.6,9.7,0,77.8662,2005-01-06 16:00:00,6
06/01/05,5:00 pm,32.9,0.6,11.3,0,62.46504,2005-01-06 17:00:00,6
06/01/05,6:00 pm,32.6,0.6,9.7,0,45.34308,2005-01-06 18:00:00,6
06/01/05,7:00 pm,31.9,0.62,9.7,0,26.32824,2005-01-06 19:00:00,6
06/01/05,8:00 pm,30.2,0.71,6.4,0,9.29232,2005-01-06 20:00:00,6
06/01/05,9:00 pm,26.8,0.79,3.2,0,0.4302,2005-01-06 21:00:00,6
06/01/05,10:00 pm,24.9,0.85,1.6,0,0,2005-01-06 22:00:00,6
06/01/05,11:00 pm,24.4,0.87,0,0,0,2005-01-06 23:00:00,6
07/01/05,12:00 am,24.1,0.86,0,0,0,2005-01-07 00:00:00,7
07/01/05,1:00 am,23.8,0.89,0,0,0,2005-01-07 01:00:00,7
07/01/05,2:00 am,24.6,0.88,1.6,0,0,2005-01-07 02:00:00,7
07/01/05,3:00 am,23.9,0.86,0,0,0,2005-01-07 03:00:00,7
07/01/05,4:00 am,24.2,0.86,1.6,0,0,2005-01-07 04:00:00,7
07/01/05,5:00 am,23.2,0.89,0,0,0,2005-01-07 05:00:00,7
07/01/05,6:00 am,21.6,0.92,0,0,0,2005-01-07 06:00:00,7
07/01/05,7:00 am,21,0.92,0,0,2.83932,2005-01-07 07:00:00,7
07/01/05,8:00 am,24.6,0.79,1.6,0,17.98236,2005-01-07 08:00:00,7
07/01/05,9:00 am,28.4,0.73,6.4,0,37.4274,2005-01-07 09:00:00,7
07/01/05,10:00 am,30.6,0.6,11.3,0,56.18412,2005-01-07 10:00:00,7
07/01/05,11:00 am,31.9,0.52,11.3,0,72.35964,2005-01-07 11:00:00,7
07/01/05,12:00 pm,33.1,0.53,11.3,0,84.3192,2005-01-07 12:00:00,7
07/01/05,1:00 pm,34.2,0.44,9.7,0,90.68616,2005-01-07 13:00:00,7
07/01/05,2:00 pm,35.1,0.42,8,0,92.14884,2005-01-07 14:00:00,7
07/01/05,3:00 pm,35.7,0.4,8,0,88.53516,2005-01-07 15:00:00,7
07/01/05,4:00 pm,36.2,0.4,6.4,0,79.07076,2005-01-07 16:00:00,7
07/01/05,5:00 pm,36.6,0.43,3.2,0,64.70208,2005-01-07 17:00:00,7
07/01/05,6:00 pm,36.6,0.5,1.6,0,47.06388,2005-01-07 18:00:00,7
07/01/05,7:00 pm,36.9,0.55,0,0,28.04904,2005-01-07 19:00:00,7
07/01/05,8:00 pm,33.7,0.49,1.6,0,9.4644,2005-01-07 20:00:00,7
07/01/05,9:00 pm,28.7,0.65,3.2,0,0.17208,2005-01-07 21:00:00,7
07/01/05,10:00 pm,25.2,0.74,3.2,0,0,2005-01-07 22:00:00,7
07/01/05,11:00 pm,23.5,0.79,3.2,0,0,2005-01-07 23:00:00,7
08/01/05,12:00 am,22.9,0.84,3.2,0,0,2005-01-08 00:00:00,8
08/01/05,1:00 am,22.6,0.82,1.6,0,0,2005-01-08 01:00:00,8
08/01/05,2:00 am,23.1,0.8,1.6,0,0,2005-01-08 02:00:00,8
08/01/05,3:00 am,23.7,0.8,3.2,0,0,2005-01-08 03:00:00,8
08/01/05,4:00 am,23.6,0.84,3.2,0,0,2005-01-08 04:00:00,8
08/01/05,5:00 am,24.1,0.86,3.2,0,0,2005-01-08 05:00:00,8
08/01/05,6:00 am,24.2,0.86,4.8,0,0,2005-01-08 06:00:00,8
08/01/05,7:00 am,24.1,0.88,1.6,0,1.54872,2005-01-08 07:00:00,8
08/01/05,8:00 am,26.3,0.76,6.4,0,15.22908,2005-01-08 08:00:00,8
08/01/05,9:00 am,29.1,0.71,8,0,34.58808,2005-01-08 09:00:00,8
08/01/05,10:00 am,31,0.68,9.7,0,52.74252,2005-01-08 10:00:00,8
08/01/05,11:00 am,32.7,0.61,11.3,0,70.5528,2005-01-08 11:00:00,8
08/01/05,12:00 pm,34.1,0.56,9.7,0,81.22176,2005-01-08 12:00:00,8
08/01/05,1:00 pm,35.6,0.49,3.2,0,87.7608,2005-01-08 13:00:00,8
08/01/05,2:00 pm,36.8,0.42,3.2,0,92.14884,2005-01-08 14:00:00,8
08/01/05,3:00 pm,37.8,0.45,1.6,0,89.65368,2005-01-08 15:00:00,8
08/01/05,4:00 pm,36.2,0.57,11.3,0,71.15508,2005-01-08 16:00:00,8
08/01/05,5:00 pm,35.2,0.6,14.5,0,61.5186,2005-01-08 17:00:00,8
08/01/05,6:00 pm,34.1,0.6,16.1,0,44.82684,2005-01-08 18:00:00,8
08/01/05,7:00 pm,33.4,0.61,12.9,0,26.58636,2005-01-08 19:00:00,8
08/01/05,8:00 pm,31.8,0.67,9.7,0,4.302,2005-01-08 20:00:00,8
08/01/05,9:00 pm,30.1,0.72,6.4,0,0.51624,2005-01-08 21:00:00,8
08/01/05,10:00 pm,29.1,0.74,8,0,0,2005-01-08 22:00:00,8
08/01/05,11:00 pm,28.6,0.71,9.7,0,0,2005-01-08 23:00:00,8
09/01/05,12:00 am,28.2,0.76,11.3,0,0,2005-01-09 00:00:00,9
09/01/05,1:00 am,27.2,0.81,8,0,0,2005-01-09 01:00:00,9
09/01/05,2:00 am,26,0.87,3.2,0,0,2005-01-09 02:00:00,9
09/01/05,3:00 am,24.8,0.87,1.6,0,0,2005-01-09 03:00:00,9
09/01/05,4:00 am,24.8,0.87,3.2,0,0,2005-01-09 04:00:00,9
09/01/05,5:00 am,25,0.85,3.2,0,0,2005-01-09 05:00:00,9
09/01/05,6:00 am,24.9,0.87,6.4,0,0,2005-01-09 06:00:00,9
09/01/05,7:00 am,24.8,0.86,4.8,0,1.54872,2005-01-09 07:00:00,9
09/01/05,8:00 am,25.4,0.86,4.8,0,3.69972,2005-01-09 08:00:00,9
09/01/05,9:00 am,24,0.91,22.5,0.127,0.77436,2005-01-09 09:00:00,9
09/01/05,10:00 am,22.2,0.93,25.7,3.48,0.25812,2005-01-09 10:00:00,9
09/01/05,11:00 am,22.3,0.92,19.3,0.762,1.63476,2005-01-09 11:00:00,9
09/01/05,12:00 pm,21.9,0.89,19.3,0.279,1.89288,2005-01-09 12:00:00,9
09/01/05,1:00 pm,21.2,0.92,11.3,0.229,1.63476,2005-01-09 13:00:00,9
09/01/05,2:00 pm,21.3,0.93,6.4,0.279,2.5812,2005-01-09 14:00:00,9
09/01/05,3:00 pm,21.6,0.93,4.8,0,5.5926,2005-01-09 15:00:00,9
09/01/05,4:00 pm,22.6,0.9,8,0,24.26328,2005-01-09 16:00:00,9
09/01/05,5:00 pm,23.4,0.88,11.3,0,25.98408,2005-01-09 17:00:00,9
09/01/05,6:00 pm,24.4,0.83,8,0,32.00688,2005-01-09 18:00:00,9
09/01/05,7:00 pm,24.7,0.87,4.8,0.025,19.44504,2005-01-09 19:00:00,9
09/01/05,8:00 pm,23.8,0.9,1.6,0,5.76468,2005-01-09 20:00:00,9
09/01/05,9:00 pm,22.7,0.93,0,0,0.4302,2005-01-09 21:00:00,9
09/01/05,10:00 pm,21.3,0.95,0,0,0,2005-01-09 22:00:00,9
09/01/05,11:00 pm,21.1,0.95,0,0,0,2005-01-09 23:00:00,9
10/01/05,12:00 am,20.3,0.96,0,0,0,2005-01-10 00:00:00,10
10/01/05,1:00 am,20,0.96,0,0,0,2005-01-10 01:00:00,10
10/01/05,2:00 am,19.9,0.96,0,0,0,2005-01-10 02:00:00,10
10/01/05,3:00 am,19.7,0.96,0,0,0,2005-01-10 03:00:00,10
10/01/05,4:00 am,19.5,0.95,0,0,0,2005-01-10 04:00:00,10
10/01/05,5:00 am,20.9,0.95,1.6,0,0,2005-01-10 05:00:00,10
10/01/05,6:00 am,21.8,0.95,6.4,0,0,2005-01-10 06:00:00,10
10/01/05,7:00 am,21.8,0.9,9.7,0,2.40912,2005-01-10 07:00:00,10
10/01/05,8:00 am,22.1,0.87,9.7,0,17.46612,2005-01-10 08:00:00,10
10/01/05,9:00 am,23.4,0.82,9.7,0,36.9972,2005-01-10 09:00:00,10
10/01/05,10:00 am,24.6,0.79,8,0,57.6468,2005-01-10 10:00:00,10
10/01/05,11:00 am,25.9,0.81,6.4,0,72.61776,2005-01-10 11:00:00,10
10/01/05,12:00 pm,27.2,0.79,6.4,0,96.3648,2005-01-10 12:00:00,10
10/01/05,1:00 pm,28.5,0.73,6.4,0,92.9232,2005-01-10 13:00:00,10
10/01/05,2:00 pm,29.3,0.67,6.4,0,100.15056,2005-01-10 14:00:00,10
10/01/05,3:00 pm,29.8,0.67,4.8,0,84.49128,2005-01-10 15:00:00,10
10/01/05,4:00 pm,30.6,0.65,6.4,0,87.3306,2005-01-10 16:00:00,10
10/01/05,5:00 pm,30.8,0.63,6.4,0,70.46676,2005-01-10 17:00:00,10
10/01/05,6:00 pm,30.7,0.68,8,0,49.0428,2005-01-10 18:00:00,10
10/01/05,7:00 pm,29.9,0.67,6.4,0,28.22112,2005-01-10 19:00:00,10
10/01/05,8:00 pm,28.4,0.78,3.2,0,9.80856,2005-01-10 20:00:00,10
10/01/05,9:00 pm,25.1,0.84,3.2,0,0.34416,2005-01-10 21:00:00,10
10/01/05,10:00 pm,24,0.81,4.8,0,0,2005-01-10 22:00:00,10
10/01/05,11:00 pm,23.7,0.81,4.8,0,0,2005-01-10 23:00:00,10
11/01/05,12:00 am,23.8,0.79,6.4,0,0,2005-01-11 00:00:00,11
11/01/05,1:00 am,23.3,0.83,4.8,0,0,2005-01-11 01:00:00,11
11/01/05,2:00 am,22,0.86,3.2,0,0,2005-01-11 02:00:00,11
11/01/05,3:00 am,21.2,0.87,1.6,0,0,2005-01-11 03:00:00,11
11/01/05,4:00 am,20.7,0.89,0,0,0,2005-01-11 04:00:00,11
11/01/05,5:00 am,19.7,0.91,0,0,0,2005-01-11 05:00:00,11
11/01/05,6:00 am,20.2,0.88,3.2,0,0,2005-01-11 06:00:00,11
11/01/05,7:00 am,20.9,0.87,3.2,0,2.66724,2005-01-11 07:00:00,11
11/01/05,8:00 am,22.3,0.81,4.8,0,14.45472,2005-01-11 08:00:00,11
11/01/05,9:00 am,24.7,0.77,8,0,36.82512,2005-01-11 09:00:00,11
11/01/05,10:00 am,26.9,0.76,9.7,0,55.75392,2005-01-11 10:00:00,11
11/01/05,11:00 am,28.8,0.71,8,0,71.49924,2005-01-11 11:00:00,11
11/01/05,12:00 pm,30.4,0.68,8,0,83.4588,2005-01-11 12:00:00,11
11/01/05,1:00 pm,31.5,0.64,6.4,0,92.493,2005-01-11 13:00:00,11
11/01/05,2:00 pm,32.2,0.59,6.4,0,90.42804,2005-01-11 14:00:00,11
11/01/05,3:00 pm,32.9,0.53,4.8,0,89.56764,2005-01-11 15:00:00,11
11/01/05,4:00 pm,33.6,0.52,3.2,0,79.75908,2005-01-11 16:00:00,11
11/01/05,5:00 pm,33.7,0.65,3.2,0,69.34824,2005-01-11 17:00:00,11
11/01/05,6:00 pm,32.8,0.66,4.8,0,47.06388,2005-01-11 18:00:00,11
11/01/05,7:00 pm,31.5,0.64,4.8,0,27.87696,2005-01-11 19:00:00,11
11/01/05,8:00 pm,28.9,0.76,3.2,0,10.15272,2005-01-11 20:00:00,11
11/01/05,9:00 pm,25.1,0.79,3.2,0,0.34416,2005-01-11 21:00:00,11
11/01/05,10:00 pm,23.6,0.82,3.2,0,0,2005-01-11 22:00:00,11
11/01/05,11:00 pm,22.9,0.88,1.6,0,0,2005-01-11 23:00:00,11
12/01/05,12:00 am,22.3,0.88,1.6,0,0,2005-01-12 00:00:00,12
12/01/05,1:00 am,22.6,0.88,0,0,0,2005-01-12 01:00:00,12
12/01/05,2:00 am,22.5,0.88,1.6,0,0,2005-01-12 02:00:00,12
12/01/05,3:00 am,21.8,0.91,0,0,0,2005-01-12 03:00:00,12
12/01/05,4:00 am,21.1,0.94,0,0,0,2005-01-12 04:00:00,12
12/01/05,5:00 am,20.7,0.92,0,0,0,2005-01-12 05:00:00,12
12/01/05,6:00 am,20.3,0.92,0,0,0,2005-01-12 06:00:00,12
12/01/05,7:00 am,20.3,0.89,1.6,0,2.40912,2005-01-12 07:00:00,12
12/01/05,8:00 am,23.3,0.83,3.2,0,18.0684,2005-01-12 08:00:00,12
12/01/05,9:00 am,26.3,0.75,6.4,0,36.22284,2005-01-12 09:00:00,12
12/01/05,10:00 am,28.6,0.72,8,0,55.32372,2005-01-12 10:00:00,12
12/01/05,11:00 am,29.9,0.64,8,0,71.32716,2005-01-12 11:00:00,12
12/01/05,12:00 pm,30.9,0.6,9.7,0,83.28672,2005-01-12 12:00:00,12
12/01/05,1:00 pm,32,0.62,8,0,90.16992,2005-01-12 13:00:00,12
12/01/05,2:00 pm,33.3,0.41,3.2,0,91.80468,2005-01-12 14:00:00,12
12/01/05,3:00 pm,33.8,0.49,3.2,0,88.70724,2005-01-12 15:00:00,12
12/01/05,4:00 pm,34.2,0.48,3.2,0,79.32888,2005-01-12 16:00:00,12
12/01/05,5:00 pm,34.1,0.61,3.2,0,64.9602,2005-01-12 17:00:00,12
12/01/05,6:00 pm,33.4,0.53,3.2,0,47.7522,2005-01-12 18:00:00,12
12/01/05,7:00 pm,33.4,0.67,1.6,0,28.90944,2005-01-12 19:00:00,12
12/01/05,8:00 pm,29.8,0.78,1.6,0,5.76468,2005-01-12 20:00:00,12
12/01/05,9:00 pm,25.8,0.82,1.6,0,0.17208,2005-01-12 21:00:00,12
12/01/05,10:00 pm,24.1,0.87,1.6,0,0,2005-01-12 22:00:00,12
12/01/05,11:00 pm,23.7,0.86,1.6,0,0,2005-01-12 23:00:00,12
13/01/05,12:00 am,23.3,0.87,1.6,0,0,2005-01-13 00:00:00,13
13/01/05,1:00 am,22.9,0.83,1.6,0,0,2005-01-13 01:00:00,13
13/01/05,2:00 am,22.7,0.89,0,0,0,2005-01-13 02:00:00,13
13/01/05,3:00 am,21.5,0.91,0,0,0,2005-01-13 03:00:00,13
13/01/05,4:00 am,21.8,0.89,1.6,0,0,2005-01-13 04:00:00,13
13/01/05,5:00 am,22.3,0.88,0,0,0,2005-01-13 05:00:00,13
13/01/05,6:00 am,21.9,0.9,1.6,0,0,2005-01-13 06:00:00,13
13/01/05,7:00 am,22.7,0.87,3.2,0,2.23704,2005-01-13 07:00:00,13
13/01/05,8:00 am,25.1,0.83,6.4,0,15.31512,2005-01-13 08:00:00,13
13/01/05,9:00 am,27.1,0.82,4.8,0,31.74876,2005-01-13 09:00:00,13
13/01/05,10:00 am,28.2,0.78,9.7,0,51.45192,2005-01-13 10:00:00,13
13/01/05,11:00 am,29.4,0.74,11.3,0,68.832,2005-01-13 11:00:00,13
13/01/05,12:00 pm,30.4,0.72,8,0,82.5984,2005-01-13 12:00:00,13
13/01/05,1:00 pm,31.6,0.68,6.4,0,91.28844,2005-01-13 13:00:00,13
13/01/05,2:00 pm,32.6,0.66,6.4,0,90.51408,2005-01-13 14:00:00,13
13/01/05,3:00 pm,32.7,0.67,6.4,0,80.96364,2005-01-13 15:00:00,13
13/01/05,4:00 pm,32.6,0.66,6.4,0,67.02516,2005-01-13 16:00:00,13
13/01/05,5:00 pm,32.6,0.65,6.4,0,60.40008,2005-01-13 17:00:00,13
13/01/05,6:00 pm,32.3,0.6,4.8,0,44.13852,2005-01-13 18:00:00,13
13/01/05,7:00 pm,31.9,0.65,4.8,0,27.18864,2005-01-13 19:00:00,13
13/01/05,8:00 pm,30,0.74,4.8,0,9.12024,2005-01-13 20:00:00,13
13/01/05,9:00 pm,26.8,0.85,1.6,0,0.51624,2005-01-13 21:00:00,13
13/01/05,10:00 pm,25.2,0.88,3.2,0,0,2005-01-13 22:00:00,13
13/01/05,11:00 pm,24.7,0.9,3.2,0,0,2005-01-13 23:00:00,13
14/01/05,12:00 am,23.8,0.91,1.6,0,0,2005-01-14 00:00:00,14
14/01/05,1:00 am,23.2,0.9,0,0,0,2005-01-14 01:00:00,14
14/01/05,2:00 am,22.6,0.91,1.6,0,0,2005-01-14 02:00:00,14
14/01/05,3:00 am,21.9,0.92,1.6,0,0,2005-01-14 03:00:00,14
14/01/05,4:00 am,21.2,0.94,1.6,0,0,2005-01-14 04:00:00,14
14/01/05,5:00 am,21.5,0.9,1.6,0,0,2005-01-14 05:00:00,14
14/01/05,6:00 am,21.4,0.89,1.6,0,0,2005-01-14 06:00:00,14
14/01/05,7:00 am,21.9,0.86,1.6,0,2.151,2005-01-14 07:00:00,14
14/01/05,8:00 am,23.4,0.86,3.2,0,10.15272,2005-01-14 08:00:00,14
14/01/05,9:00 am,25.6,0.79,6.4,0,31.31856,2005-01-14 09:00:00,14
14/01/05,10:00 am,28.3,0.73,8,0,49.473,2005-01-14 10:00:00,14
14/01/05,11:00 am,29.8,0.68,8,0,62.46504,2005-01-14 11:00:00,14
14/01/05,12:00 pm,32.3,0.68,8,0,80.18928,2005-01-14 12:00:00,14
14/01/05,1:00 pm,33.6,0.58,9.7,0,86.81436,2005-01-14 13:00:00,14
14/01/05,2:00 pm,34.7,0.54,9.7,0,88.36308,2005-01-14 14:00:00,14
14/01/05,3:00 pm,34.8,0.55,9.7,0,84.83544,2005-01-14 15:00:00,14
14/01/05,4:00 pm,35.1,0.62,8,0,78.89868,2005-01-14 16:00:00,14
14/01/05,5:00 pm,35.2,0.63,6.4,0,61.5186,2005-01-14 17:00:00,14
14/01/05,6:00 pm,33.3,0.73,3.2,0,20.82168,2005-01-14 18:00:00,14
14/01/05,7:00 pm,33.3,0.78,0,0,10.66896,2005-01-14 19:00:00,14
14/01/05,8:00 pm,31.6,0.68,3.2,0,1.37664,2005-01-14 20:00:00,14
14/01/05,9:00 pm,24.5,0.95,24.1,1.956,0,2005-01-14 21:00:00,14
14/01/05,10:00 pm,21.2,0.95,11.3,0.635,0,2005-01-14 22:00:00,14
14/01/05,11:00 pm,21.5,0.95,9.7,0.152,0,2005-01-14 23:00:00,14
15/01/05,12:00 am,21.6,0.95,6.4,0.33,0,2005-01-15 00:00:00,15
15/01/05,1:00 am,21.4,0.95,4.8,0.102,0,2005-01-15 01:00:00,15
15/01/05,2:00 am,21.3,0.96,1.6,0,0,2005-01-15 02:00:00,15
15/01/05,3:00 am,21.4,0.96,3.2,0,0,2005-01-15 03:00:00,15
15/01/05,4:00 am,21.3,0.95,4.8,0,0,2005-01-15 04:00:00,15
15/01/05,5:00 am,21.2,0.94,8,0,0,2005-01-15 05:00:00,15
15/01/05,6:00 am,21.3,0.94,9.7,0,0,2005-01-15 06:00:00,15
15/01/05,7:00 am,21.3,0.94,8,0,0.34416,2005-01-15 07:00:00,15
15/01/05,8:00 am,21.4,0.94,8,0,5.76468,2005-01-15 08:00:00,15
15/01/05,9:00 am,21.9,0.92,9.7,0,12.906,2005-01-15 09:00:00,15
15/01/05,10:00 am,22.5,0.92,11.3,0,20.30544,2005-01-15 10:00:00,15
15/01/05,11:00 am,23.9,0.86,12.9,0,34.8462,2005-01-15 11:00:00,15
15/01/05,12:00 pm,25.4,0.76,14.5,0,87.84684,2005-01-15 12:00:00,15
15/01/05,1:00 pm,26.4,0.7,14.5,0,90.342,2005-01-15 13:00:00,15
15/01/05,2:00 pm,27.4,0.67,14.5,0,93.52548,2005-01-15 14:00:00,15
15/01/05,3:00 pm,27.9,0.62,14.5,0,88.44912,2005-01-15 15:00:00,15
15/01/05,4:00 pm,28,0.56,12.9,0,79.67304,2005-01-15 16:00:00,15
15/01/05,5:00 pm,28,0.5,12.9,0,66.33684,2005-01-15 17:00:00,15
15/01/05,6:00 pm,27.9,0.47,11.3,0,48.1824,2005-01-15 18:00:00,15
15/01/05,7:00 pm,26.9,0.52,11.3,0,28.8234,2005-01-15 19:00:00,15
15/01/05,8:00 pm,24.7,0.72,4.8,0,10.41084,2005-01-15 20:00:00,15
15/01/05,9:00 pm,20.9,0.77,3.2,0,0.4302,2005-01-15 21:00:00,15
15/01/05,10:00 pm,20.1,0.81,4.8,0,0,2005-01-15 22:00:00,15
15/01/05,11:00 pm,19.6,0.84,4.8,0,0,2005-01-15 23:00:00,15
16/01/05,12:00 am,19.1,0.85,4.8,0,0,2005-01-16 00:00:00,16
16/01/05,1:00 am,18.7,0.88,3.2,0,0,2005-01-16 01:00:00,16
16/01/05,2:00 am,18.3,0.89,3.2,0,0,2005-01-16 02:00:00,16
16/01/05,3:00 am,17.7,0.91,1.6,0,0,2005-01-16 03:00:00,16
16/01/05,4:00 am,16.9,0.93,0,0,0,2005-01-16 04:00:00,16
16/01/05,5:00 am,16,0.94,0,0,0,2005-01-16 05:00:00,16
16/01/05,6:00 am,15.7,0.94,0,0,0,2005-01-16 06:00:00,16
16/01/05,7:00 am,15.5,0.94,0,0,2.06496,2005-01-16 07:00:00,16
16/01/05,8:00 am,18.6,0.84,1.6,0,18.0684,2005-01-16 08:00:00,16
16/01/05,9:00 am,22.7,0.71,3.2,0,36.30888,2005-01-16 09:00:00,16
16/01/05,10:00 am,24.4,0.68,6.4,0,55.40976,2005-01-16 10:00:00,16
16/01/05,11:00 am,25.9,0.61,8,0,71.49924,2005-01-16 11:00:00,16
16/01/05,12:00 pm,26.8,0.57,8,0,83.37276,2005-01-16 12:00:00,16
16/01/05,1:00 pm,27.6,0.58,8,0,90.51408,2005-01-16 13:00:00,16
16/01/05,2:00 pm,28.4,0.53,6.4,0,91.89072,2005-01-16 14:00:00,16
16/01/05,3:00 pm,29.1,0.54,4.8,0,88.79328,2005-01-16 15:00:00,16
16/01/05,4:00 pm,29.3,0.49,4.8,0,79.07076,2005-01-16 16:00:00,16
16/01/05,5:00 pm,29.6,0.55,4.8,0,65.04624,2005-01-16 17:00:00,16
16/01/05,6:00 pm,29.2,0.52,4.8,0,47.83824,2005-01-16 18:00:00,16
16/01/05,7:00 pm,28.9,0.61,3.2,0,28.73736,2005-01-16 19:00:00,16
16/01/05,8:00 pm,26.7,0.75,1.6,0,10.15272,2005-01-16 20:00:00,16
16/01/05,9:00 pm,22.4,0.84,1.6,0,0.4302,2005-01-16 21:00:00,16
16/01/05,10:00 pm,20.3,0.87,1.6,0,0,2005-01-16 22:00:00,16
16/01/05,11:00 pm,19.4,0.83,3.2,0,0,2005-01-16 23:00:00,16
17/01/05,12:00 am,17.8,0.9,1.6,0,0,2005-01-17 00:00:00,17
17/01/05,1:00 am,16.8,0.89,1.6,0,0,2005-01-17 01:00:00,17
17/01/05,2:00 am,16.2,0.91,0,0,0,2005-01-17 02:00:00,17
17/01/05,3:00 am,15.7,0.92,0,0,0,2005-01-17 03:00:00,17
17/01/05,4:00 am,14.9,0.93,0,0,0,2005-01-17 04:00:00,17
17/01/05,5:00 am,14.3,0.91,0,0,0,2005-01-17 05:00:00,17
17/01/05,6:00 am,13.9,0.92,0,0,0,2005-01-17 06:00:00,17
17/01/05,7:00 am,14,0.89,0,0,2.06496,2005-01-17 07:00:00,17
17/01/05,8:00 am,17.5,0.79,1.6,0,18.41256,2005-01-17 08:00:00,17
17/01/05,9:00 am,21.2,0.73,3.2,0,36.48096,2005-01-17 09:00:00,17
17/01/05,10:00 am,24.4,0.63,4.8,0,55.15164,2005-01-17 10:00:00,17
17/01/05,11:00 am,26.3,0.53,8,0,70.983,2005-01-17 11:00:00,17
17/01/05,12:00 pm,27.6,0.54,8,0,82.85652,2005-01-17 12:00:00,17
17/01/05,1:00 pm,28.8,0.5,6.4,0,89.82576,2005-01-17 13:00:00,17
17/01/05,2:00 pm,29.6,0.49,4.8,0,91.46052,2005-01-17 14:00:00,17
17/01/05,3:00 pm,30.3,0.43,3.2,0,87.7608,2005-01-17 15:00:00,17
17/01/05,4:00 pm,31,0.34,1.6,0,79.07076,2005-01-17 16:00:00,17
17/01/05,5:00 pm,31.8,0.36,0,0,67.71348,2005-01-17 17:00:00,17
17/01/05,6:00 pm,33,0.39,0,0,47.40804,2005-01-17 18:00:00,17
17/01/05,7:00 pm,30.6,0.71,1.6,0,20.6496,2005-01-17 19:00:00,17
17/01/05,8:00 pm,25.8,0.77,1.6,0,4.47408,2005-01-17 20:00:00,17
17/01/05,9:00 pm,22.8,0.83,0,0,0.34416,2005-01-17 21:00:00,17
17/01/05,10:00 pm,20.6,0.85,0,0,0,2005-01-17 22:00:00,17
17/01/05,11:00 pm,20.1,0.88,1.6,0,0,2005-01-17 23:00:00,17
18/01/05,12:00 am,19.1,0.9,1.6,0,0,2005-01-18 00:00:00,18
18/01/05,1:00 am,18.7,0.91,0,0,0,2005-01-18 01:00:00,18
18/01/05,2:00 am,18.2,0.92,0,0,0,2005-01-18 02:00:00,18
18/01/05,3:00 am,17.5,0.93,0,0,0,2005-01-18 03:00:00,18
18/01/05,4:00 am,16.4,0.9,0,0,0,2005-01-18 04:00:00,18
18/01/05,5:00 am,15.9,0.92,0,0,0,2005-01-18 05:00:00,18
18/01/05,6:00 am,15.5,0.93,0,0,0,2005-01-18 06:00:00,18
18/01/05,7:00 am,15.1,0.92,0,0,1.97892,2005-01-18 07:00:00,18
18/01/05,8:00 am,19.3,0.68,0,0,16.94988,2005-01-18 08:00:00,18
18/01/05,9:00 am,24.7,0.68,0,0,34.8462,2005-01-18 09:00:00,18
18/01/05,10:00 am,27.5,0.63,1.6,0,53.43084,2005-01-18 10:00:00,18
18/01/05,11:00 am,27.5,0.62,8,0,68.4018,2005-01-18 11:00:00,18
18/01/05,12:00 pm,28.9,0.59,6.4,0,80.27532,2005-01-18 12:00:00,18
18/01/05,1:00 pm,29.8,0.55,6.4,0,88.6212,2005-01-18 13:00:00,18
18/01/05,2:00 pm,30.9,0.52,3.2,0,89.39556,2005-01-18 14:00:00,18
18/01/05,3:00 pm,31.1,0.53,3.2,0,85.35168,2005-01-18 15:00:00,18
18/01/05,4:00 pm,32.1,0.42,1.6,0,76.5756,2005-01-18 16:00:00,18
18/01/05,5:00 pm,32.8,0.49,1.6,0,62.72316,2005-01-18 17:00:00,18
18/01/05,6:00 pm,31.9,0.52,1.6,0,45.77328,2005-01-18 18:00:00,18
18/01/05,7:00 pm,30.9,0.6,1.6,0,26.84448,2005-01-18 19:00:00,18
18/01/05,8:00 pm,28.1,0.74,1.6,0,9.20628,2005-01-18 20:00:00,18
18/01/05,9:00 pm,23.6,0.82,1.6,0,0.25812,2005-01-18 21:00:00,18
18/01/05,10:00 pm,22.2,0.8,1.6,0,0,2005-01-18 22:00:00,18
18/01/05,11:00 pm,21.7,0.86,0,0,0,2005-01-18 23:00:00,18
19/01/05,12:00 am,21.6,0.88,1.6,0,0,2005-01-19 00:00:00,19
19/01/05,1:00 am,20.8,0.87,0,0,0,2005-01-19 01:00:00,19
19/01/05,2:00 am,20.6,0.87,1.6,0,0,2005-01-19 02:00:00,19
19/01/05,3:00 am,20,0.84,3.2,0,0,2005-01-19 03:00:00,19
19/01/05,4:00 am,19.9,0.82,3.2,0,0,2005-01-19 04:00:00,19
19/01/05,5:00 am,18.8,0.84,3.2,0,0,2005-01-19 05:00:00,19
19/01/05,6:00 am,17.6,0.83,3.2,0,0,2005-01-19 06:00:00,19
19/01/05,7:00 am,17.6,0.84,3.2,0,1.11852,2005-01-19 07:00:00,19
19/01/05,8:00 am,19.7,0.73,3.2,0,16.17552,2005-01-19 08:00:00,19
19/01/05,9:00 am,22.9,0.73,6.4,0,33.72768,2005-01-19 09:00:00,19
19/01/05,10:00 am,25.1,0.65,6.4,0,51.79608,2005-01-19 10:00:00,19
19/01/05,11:00 am,27.9,0.61,1.6,0,67.88556,2005-01-19 11:00:00,19
19/01/05,12:00 pm,29.9,0.58,1.6,0,80.36136,2005-01-19 12:00:00,19
19/01/05,1:00 pm,31.5,0.56,3.2,0,89.9118,2005-01-19 13:00:00,19
19/01/05,2:00 pm,30.5,0.66,11.3,0,92.23488,2005-01-19 14:00:00,19
19/01/05,3:00 pm,29.7,0.63,12.9,0,68.832,2005-01-19 15:00:00,19
19/01/05,4:00 pm,28.4,0.63,9.7,0,40.35276,2005-01-19 16:00:00,19
19/01/05,5:00 pm,27.3,0.68,4.8,0,23.31684,2005-01-19 17:00:00,19
19/01/05,6:00 pm,28.8,0.68,3.2,0,28.65132,2005-01-19 18:00:00,19
19/01/05,7:00 pm,29,0.7,1.6,0,19.61712,2005-01-19 19:00:00,19
19/01/05,8:00 pm,28.1,0.75,0,0,9.20628,2005-01-19 20:00:00,19
19/01/05,9:00 pm,23.4,0.82,1.6,0,0.25812,2005-01-19 21:00:00,19
19/01/05,10:00 pm,20.9,0.85,1.6,0,0,2005-01-19 22:00:00,19
19/01/05,11:00 pm,19.8,0.87,1.6,0,0,2005-01-19 23:00:00,19
20/01/05,12:00 am,18.5,0.92,0,0,0,2005-01-20 00:00:00,20
20/01/05,1:00 am,18.6,0.91,1.6,0,0,2005-01-20 01:00:00,20
20/01/05,2:00 am,19.9,0.88,4.8,0,0,2005-01-20 02:00:00,20
20/01/05,3:00 am,20.1,0.87,8,0,0,2005-01-20 03:00:00,20
20/01/05,4:00 am,19.2,0.9,8,0,0,2005-01-20 04:00:00,20
20/01/05,5:00 am,19.2,0.76,11.3,0,0,2005-01-20 05:00:00,20
20/01/05,6:00 am,18.5,0.69,14.5,0,0,2005-01-20 06:00:00,20
20/01/05,7:00 am,17.6,0.69,12.9,0,1.2906,2005-01-20 07:00:00,20
20/01/05,8:00 am,17.7,0.65,12.9,0,14.88492,2005-01-20 08:00:00,20
20/01/05,9:00 am,19.2,0.55,12.9,0,35.01828,2005-01-20 09:00:00,20
20/01/05,10:00 am,20.8,0.5,12.9,0,54.37728,2005-01-20 10:00:00,20
20/01/05,11:00 am,22.3,0.55,11.3,0,70.72488,2005-01-20 11:00:00,20
20/01/05,12:00 pm,23.4,0.45,11.3,0,83.4588,2005-01-20 12:00:00,20
20/01/05,1:00 pm,24.2,0.47,11.3,0,90.342,2005-01-20 13:00:00,20
20/01/05,2:00 pm,24.8,0.47,12.9,0,92.14884,2005-01-20 14:00:00,20
20/01/05,3:00 pm,25.3,0.37,14.5,0,89.13744,2005-01-20 15:00:00,20
20/01/05,4:00 pm,25.7,0.41,12.9,0,79.93116,2005-01-20 16:00:00,20
20/01/05,5:00 pm,26,0.35,11.3,0,66.2508,2005-01-20 17:00:00,20
20/01/05,6:00 pm,25.9,0.41,8,0,48.6126,2005-01-20 18:00:00,20
20/01/05,7:00 pm,24.9,0.43,8,0,29.08152,2005-01-20 19:00:00,20
20/01/05,8:00 pm,22.1,0.65,3.2,0,10.49688,2005-01-20 20:00:00,20
20/01/05,9:00 pm,16.2,0.75,3.2,0,0.34416,2005-01-20 21:00:00,20
20/01/05,10:00 pm,14.2,0.8,3.2,0,0,2005-01-20 22:00:00,20
20/01/05,11:00 pm,13.7,0.82,1.6,0,0,2005-01-20 23:00:00,20
21/01/05,12:00 am,13.5,0.81,1.6,0,0,2005-01-21 00:00:00,21
21/01/05,1:00 am,13.4,0.85,3.2,0,0,2005-01-21 01:00:00,21
21/01/05,2:00 am,12.7,0.87,0,0,0,2005-01-21 02:00:00,21
21/01/05,3:00 am,11.3,0.9,0,0,0,2005-01-21 03:00:00,21
21/01/05,4:00 am,11.4,0.91,0,0,0,2005-01-21 04:00:00,21
21/01/05,5:00 am,11.2,0.9,0,0,0,2005-01-21 05:00:00,21
21/01/05,6:00 am,10.8,0.91,0,0,0,2005-01-21 06:00:00,21
21/01/05,7:00 am,11.9,0.88,3.2,0,1.63476,2005-01-21 07:00:00,21
21/01/05,8:00 am,15,0.82,4.8,0,17.29404,2005-01-21 08:00:00,21
21/01/05,9:00 am,19.1,0.68,6.4,0,35.2764,2005-01-21 09:00:00,21
21/01/05,10:00 am,22.3,0.54,9.7,0,53.68896,2005-01-21 10:00:00,21
21/01/05,11:00 am,24.9,0.49,11.3,0,69.60636,2005-01-21 11:00:00,21
21/01/05,12:00 pm,26.5,0.48,8,0,81.56592,2005-01-21 12:00:00,21
21/01/05,1:00 pm,27.8,0.43,8,0,88.6212,2005-01-21 13:00:00,21
21/01/05,2:00 pm,29.3,0.39,6.4,0,90.16992,2005-01-21 14:00:00,21
21/01/05,3:00 pm,30.1,0.36,6.4,0,86.55624,2005-01-21 15:00:00,21
21/01/05,4:00 pm,30.9,0.35,6.4,0,77.09184,2005-01-21 16:00:00,21
21/01/05,5:00 pm,31.1,0.27,6.4,0,63.32544,2005-01-21 17:00:00,21
21/01/05,6:00 pm,30.8,0.31,6.4,0,46.0314,2005-01-21 18:00:00,21
21/01/05,7:00 pm,29.4,0.4,8,0,26.84448,2005-01-21 19:00:00,21
21/01/05,8:00 pm,26.1,0.66,4.8,0,9.12024,2005-01-21 20:00:00,21
21/01/05,9:00 pm,20.4,0.78,1.6,0,0.25812,2005-01-21 21:00:00,21
21/01/05,10:00 pm,17.9,0.8,1.6,0,0,2005-01-21 22:00:00,21
21/01/05,11:00 pm,17.2,0.83,1.6,0,0,2005-01-21 23:00:00,21
22/01/05,12:00 am,16.9,0.8,1.6,0,0,2005-01-22 00:00:00,22
22/01/05,1:00 am,17.1,0.8,3.2,0,0,2005-01-22 01:00:00,22
22/01/05,2:00 am,17.7,0.69,3.2,0,0,2005-01-22 02:00:00,22
22/01/05,3:00 am,19.6,0.67,6.4,0,0,2005-01-22 03:00:00,22
22/01/05,4:00 am,19.1,0.74,4.8,0,0,2005-01-22 04:00:00,22
22/01/05,5:00 am,17.7,0.79,4.8,0,0,2005-01-22 05:00:00,22
22/01/05,6:00 am,17.8,0.79,6.4,0,0,2005-01-22 06:00:00,22
22/01/05,7:00 am,18.4,0.73,4.8,0,1.89288,2005-01-22 07:00:00,22
22/01/05,8:00 am,21.1,0.69,8,0,13.3362,2005-01-22 08:00:00,22
22/01/05,9:00 am,24.2,0.63,9.7,0,34.07184,2005-01-22 09:00:00,22
22/01/05,10:00 am,26.5,0.6,8,0,49.98924,2005-01-22 10:00:00,22
22/01/05,11:00 am,28.4,0.59,9.7,0,69.09012,2005-01-22 11:00:00,22
22/01/05,12:00 pm,29.5,0.5,6.4,0,68.05764,2005-01-22 12:00:00,22
22/01/05,1:00 pm,30.2,0.52,4.8,0,53.08668,2005-01-22 13:00:00,22
22/01/05,2:00 pm,32.1,0.41,3.2,0,66.2508,2005-01-22 14:00:00,22
22/01/05,3:00 pm,33.1,0.34,1.6,0,62.46504,2005-01-22 15:00:00,22
22/01/05,4:00 pm,33.8,0.45,0,0,41.04108,2005-01-22 16:00:00,22
22/01/05,5:00 pm,32,0.53,3.2,0,32.95332,2005-01-22 17:00:00,22
22/01/05,6:00 pm,30.8,0.49,4.8,0,27.36072,2005-01-22 18:00:00,22
22/01/05,7:00 pm,29.7,0.49,9.7,0,14.6268,2005-01-22 19:00:00,22
22/01/05,8:00 pm,28.2,0.57,6.4,0,5.50656,2005-01-22 20:00:00,22
22/01/05,9:00 pm,26.4,0.71,4.8,0,0.34416,2005-01-22 21:00:00,22
22/01/05,10:00 pm,24.1,0.76,3.2,0,0,2005-01-22 22:00:00,22
22/01/05,11:00 pm,24.1,0.74,4.8,0,0,2005-01-22 23:00:00,22
23/01/05,12:00 am,22.8,0.83,1.6,0,0,2005-01-23 00:00:00,23
23/01/05,1:00 am,21.7,0.89,1.6,0,0,2005-01-23 01:00:00,23
23/01/05,2:00 am,20.9,0.92,1.6,0,0,2005-01-23 02:00:00,23
23/01/05,3:00 am,21.3,0.91,1.6,0,0,2005-01-23 03:00:00,23
23/01/05,4:00 am,22,0.86,6.4,0,0,2005-01-23 04:00:00,23
23/01/05,5:00 am,21.7,0.87,6.4,0,0,2005-01-23 05:00:00,23
23/01/05,6:00 am,21.1,0.85,8,0,0,2005-01-23 06:00:00,23
23/01/05,7:00 am,20.6,0.85,6.4,0,1.20456,2005-01-23 07:00:00,23
23/01/05,8:00 am,21.4,0.78,8,0,12.4758,2005-01-23 08:00:00,23
23/01/05,9:00 am,23.1,0.72,8,0,23.91912,2005-01-23 09:00:00,23
23/01/05,10:00 am,25.4,0.62,8,0,47.23596,2005-01-23 10:00:00,23
23/01/05,11:00 am,27,0.63,9.7,0,55.75392,2005-01-23 11:00:00,23
23/01/05,12:00 pm,28.7,0.56,8,0,72.35964,2005-01-23 12:00:00,23
23/01/05,1:00 pm,30.6,0.53,6.4,0,90.08388,2005-01-23 13:00:00,23
23/01/05,2:00 pm,32.2,0.52,3.2,0,79.75908,2005-01-23 14:00:00,23
23/01/05,3:00 pm,32.9,0.48,3.2,0,75.88728,2005-01-23 15:00:00,23
23/01/05,4:00 pm,33.2,0.45,3.2,0,61.17444,2005-01-23 16:00:00,23
23/01/05,5:00 pm,32.8,0.41,1.6,0,46.37556,2005-01-23 17:00:00,23
23/01/05,6:00 pm,33.6,0.42,0,0,47.40804,2005-01-23 18:00:00,23
23/01/05,7:00 pm,32.1,0.59,1.6,0,24.43536,2005-01-23 19:00:00,23
23/01/05,8:00 pm,29.4,0.73,1.6,0,9.37836,2005-01-23 20:00:00,23
23/01/05,9:00 pm,26.7,0.82,0,0,0.4302,2005-01-23 21:00:00,23
23/01/05,10:00 pm,24.6,0.84,0,0,0,2005-01-23 22:00:00,23
23/01/05,11:00 pm,23,0.84,0,0,0,2005-01-23 23:00:00,23
24/01/05,12:00 am,22.3,0.86,1.6,0,0,2005-01-24 00:00:00,24
24/01/05,1:00 am,21.4,0.81,0,0,0,2005-01-24 01:00:00,24
24/01/05,2:00 am,20.8,0.77,3.2,0,0,2005-01-24 02:00:00,24
24/01/05,3:00 am,20.7,0.82,1.6,0,0,2005-01-24 03:00:00,24
24/01/05,4:00 am,21.7,0.83,0,0,0,2005-01-24 04:00:00,24
24/01/05,5:00 am,21.2,0.88,0,0,0,2005-01-24 05:00:00,24
24/01/05,6:00 am,20.8,0.9,1.6,0,0,2005-01-24 06:00:00,24
24/01/05,7:00 am,22.2,0.73,12.9,0,0.4302,2005-01-24 07:00:00,24
24/01/05,8:00 am,21.8,0.73,12.9,0,11.01312,2005-01-24 08:00:00,24
24/01/05,9:00 am,23.3,0.71,12.9,0,21.16584,2005-01-24 09:00:00,24
24/01/05,10:00 am,25.1,0.69,9.7,0,27.01656,2005-01-24 10:00:00,24
24/01/05,11:00 am,26.7,0.65,8,0,37.4274,2005-01-24 11:00:00,24
24/01/05,12:00 pm,27.7,0.57,6.4,0,38.54592,2005-01-24 12:00:00,24
24/01/05,1:00 pm,30.6,0.51,8,0,75.37104,2005-01-24 13:00:00,24
24/01/05,2:00 pm,30.6,0.55,17.7,0,90.60012,2005-01-24 14:00:00,24
24/01/05,3:00 pm,30.1,0.55,16.1,0,90.60012,2005-01-24 15:00:00,24
24/01/05,4:00 pm,28.8,0.56,16.1,0,43.79436,2005-01-24 16:00:00,24
24/01/05,5:00 pm,29.9,0.48,17.7,0,65.99268,2005-01-24 17:00:00,24
24/01/05,6:00 pm,30.1,0.49,14.5,0,45.171,2005-01-24 18:00:00,24
24/01/05,7:00 pm,29.4,0.42,14.5,0,26.41428,2005-01-24 19:00:00,24
24/01/05,8:00 pm,27.4,0.48,9.7,0,9.12024,2005-01-24 20:00:00,24
24/01/05,9:00 pm,23.3,0.6,6.4,0,0.25812,2005-01-24 21:00:00,24
24/01/05,10:00 pm,20.4,0.78,3.2,0,0,2005-01-24 22:00:00,24
24/01/05,11:00 pm,19.1,0.67,6.4,0,0,2005-01-24 23:00:00,24
25/01/05,12:00 am,18.3,0.72,4.8,0,0,2005-01-25 00:00:00,25
25/01/05,1:00 am,16.2,0.81,3.2,0,0,2005-01-25 01:00:00,25
25/01/05,2:00 am,14.6,0.85,3.2,0,0,2005-01-25 02:00:00,25
25/01/05,3:00 am,14,0.85,3.2,0,0,2005-01-25 03:00:00,25
25/01/05,4:00 am,13.6,0.88,3.2,0,0,2005-01-25 04:00:00,25
25/01/05,5:00 am,12.4,0.89,3.2,0,0,2005-01-25 05:00:00,25
25/01/05,6:00 am,11.4,0.87,3.2,0,0,2005-01-25 06:00:00,25
25/01/05,7:00 am,11.9,0.86,3.2,0,1.7208,2005-01-25 07:00:00,25
25/01/05,8:00 am,13.6,0.79,4.8,0,9.12024,2005-01-25 08:00:00,25
25/01/05,9:00 am,17.4,0.72,11.3,0,19.87524,2005-01-25 09:00:00,25
25/01/05,10:00 am,20.9,0.57,14.5,0,46.20348,2005-01-25 10:00:00,25
25/01/05,11:00 am,23.6,0.55,12.9,0,65.47644,2005-01-25 11:00:00,25
25/01/05,12:00 pm,24.7,0.43,9.7,0,66.42288,2005-01-25 12:00:00,25
25/01/05,1:00 pm,25.6,0.39,11.3,0,67.36932,2005-01-25 13:00:00,25
25/01/05,2:00 pm,27.1,0.36,11.3,0,93.69756,2005-01-25 14:00:00,25
25/01/05,3:00 pm,27.7,0.33,9.7,0,83.20068,2005-01-25 15:00:00,25
25/01/05,4:00 pm,28,0.31,11.3,0,67.9716,2005-01-25 16:00:00,25
25/01/05,5:00 pm,27.2,0.27,9.7,0,42.24564,2005-01-25 17:00:00,25
25/01/05,6:00 pm,27.2,0.31,11.3,0,43.8804,2005-01-25 18:00:00,25
25/01/05,7:00 pm,26.3,0.33,6.4,0,27.87696,2005-01-25 19:00:00,25
25/01/05,8:00 pm,23.5,0.56,3.2,0,8.43192,2005-01-25 20:00:00,25
25/01/05,9:00 pm,18.3,0.7,1.6,0,0.34416,2005-01-25 21:00:00,25
25/01/05,10:00 pm,14.7,0.7,0,0,0,2005-01-25 22:00:00,25
25/01/05,11:00 pm,13.9,0.73,1.6,0,0,2005-01-25 23:00:00,25
26/01/05,12:00 am,12.2,0.82,0,0,0,2005-01-26 00:00:00,26
26/01/05,1:00 am,10.3,0.86,0,0,0,2005-01-26 01:00:00,26
26/01/05,2:00 am,9,0.89,0,0,0,2005-01-26 02:00:00,26
26/01/05,3:00 am,8.2,0.9,0,0,0,2005-01-26 03:00:00,26
26/01/05,4:00 am,7.4,0.89,0,0,0,2005-01-26 04:00:00,26
26/01/05,5:00 am,6.9,0.91,0,0,0,2005-01-26 05:00:00,26
26/01/05,6:00 am,6.9,0.88,0,0,0,2005-01-26 06:00:00,26
26/01/05,7:00 am,6.7,0.91,0,0,1.11852,2005-01-26 07:00:00,26
26/01/05,8:00 am,11.2,0.82,0,0,16.08948,2005-01-26 08:00:00,26
26/01/05,9:00 am,17.4,0.52,6.4,0,34.15788,2005-01-26 09:00:00,26
26/01/05,10:00 am,21.3,0.4,12.9,0,53.51688,2005-01-26 10:00:00,26
26/01/05,11:00 am,24.6,0.27,12.9,0,70.1226,2005-01-26 11:00:00,26
26/01/05,12:00 pm,26.7,0.27,9.7,0,82.42632,2005-01-26 12:00:00,26
26/01/05,1:00 pm,28.2,0.26,9.7,0,90.08388,2005-01-26 13:00:00,26
26/01/05,2:00 pm,29.1,0.25,9.7,0,91.71864,2005-01-26 14:00:00,26
26/01/05,3:00 pm,29.6,0.23,9.7,0,87.93288,2005-01-26 15:00:00,26
26/01/05,4:00 pm,29.8,0.23,9.7,0,78.64056,2005-01-26 16:00:00,26
26/01/05,5:00 pm,29.4,0.25,11.3,0,63.92772,2005-01-26 17:00:00,26
26/01/05,6:00 pm,28.7,0.25,9.7,0,47.06388,2005-01-26 18:00:00,26
26/01/05,7:00 pm,27.4,0.33,8,0,27.1026,2005-01-26 19:00:00,26
26/01/05,8:00 pm,23.9,0.64,3.2,0,9.12024,2005-01-26 20:00:00,26
26/01/05,9:00 pm,18.2,0.73,1.6,0,0.25812,2005-01-26 21:00:00,26
26/01/05,10:00 pm,15.3,0.76,1.6,0,0,2005-01-26 22:00:00,26
26/01/05,11:00 pm,13.8,0.8,1.6,0,0,2005-01-26 23:00:00,26
27/01/05,12:00 am,12.8,0.8,1.6,0,0,2005-01-27 00:00:00,27
27/01/05,1:00 am,12.3,0.8,1.6,0,0,2005-01-27 01:00:00,27
27/01/05,2:00 am,11.4,0.83,0,0,0,2005-01-27 02:00:00,27
27/01/05,3:00 am,10.6,0.85,0,0,0,2005-01-27 03:00:00,27
27/01/05,4:00 am,9.1,0.91,0,0,0,2005-01-27 04:00:00,27
27/01/05,5:00 am,8.7,0.88,0,0,0,2005-01-27 05:00:00,27
27/01/05,6:00 am,9.3,0.88,1.6,0,0,2005-01-27 06:00:00,27
27/01/05,7:00 am,10,0.86,1.6,0,0.94644,2005-01-27 07:00:00,27
27/01/05,8:00 am,13.1,0.81,1.6,0,15.057,2005-01-27 08:00:00,27
27/01/05,9:00 am,19.4,0.59,4.8,0,33.03936,2005-01-27 09:00:00,27
27/01/05,10:00 am,24.4,0.39,11.3,0,53.08668,2005-01-27 10:00:00,27
27/01/05,11:00 am,27.1,0.33,14.5,0,68.832,2005-01-27 11:00:00,27
27/01/05,12:00 pm,28.6,0.28,14.5,0,80.70552,2005-01-27 12:00:00,27
27/01/05,1:00 pm,29.5,0.29,14.5,0,89.0514,2005-01-27 13:00:00,27
27/01/05,2:00 pm,29.8,0.28,14.5,0,91.97676,2005-01-27 14:00:00,27
27/01/05,3:00 pm,29.7,0.3,9.7,0,52.9146,2005-01-27 15:00:00,27
27/01/05,4:00 pm,30.6,0.26,11.3,0,80.61948,2005-01-27 16:00:00,27
27/01/05,5:00 pm,31.1,0.28,11.3,0,63.49752,2005-01-27 17:00:00,27
27/01/05,6:00 pm,30.6,0.31,9.7,0,45.77328,2005-01-27 18:00:00,27
27/01/05,7:00 pm,29.1,0.35,8,0,27.18864,2005-01-27 19:00:00,27
27/01/05,8:00 pm,26.6,0.63,1.6,0,9.98064,2005-01-27 20:00:00,27
27/01/05,9:00 pm,20.3,0.64,1.6,0,0.17208,2005-01-27 21:00:00,27
27/01/05,10:00 pm,18.3,0.76,1.6,0,0,2005-01-27 22:00:00,27
27/01/05,11:00 pm,16.6,0.78,1.6,0,0,2005-01-27 23:00:00,27
28/01/05,12:00 am,15.7,0.81,1.6,0,0,2005-01-28 00:00:00,28
28/01/05,1:00 am,15.1,0.77,0,0,0,2005-01-28 01:00:00,28
28/01/05,2:00 am,15.4,0.81,0,0,0,2005-01-28 02:00:00,28
28/01/05,3:00 am,14.4,0.85,0,0,0,2005-01-28 03:00:00,28
28/01/05,4:00 am,13.7,0.9,0,0,0,2005-01-28 04:00:00,28
28/01/05,5:00 am,12.8,0.89,0,0,0,2005-01-28 05:00:00,28
28/01/05,6:00 am,12.2,0.9,0,0,0,2005-01-28 06:00:00,28
28/01/05,7:00 am,11.8,0.93,0,0,0.8604,2005-01-28 07:00:00,28
28/01/05,8:00 am,15.5,0.86,1.6,0,13.50828,2005-01-28 08:00:00,28
28/01/05,9:00 am,21.7,0.65,3.2,0,31.06044,2005-01-28 09:00:00,28
28/01/05,10:00 am,26.4,0.51,4.8,0,49.98924,2005-01-28 10:00:00,28
28/01/05,11:00 am,29.3,0.46,4.8,0,66.2508,2005-01-28 11:00:00,28
28/01/05,12:00 pm,31.1,0.34,6.4,0,78.7266,2005-01-28 12:00:00,28
28/01/05,1:00 pm,32.7,0.28,4.8,0,86.12604,2005-01-28 13:00:00,28
28/01/05,2:00 pm,34.2,0.25,4.8,0,88.70724,2005-01-28 14:00:00,28
28/01/05,3:00 pm,34.5,0.31,3.2,0,72.35964,2005-01-28 15:00:00,28
28/01/05,4:00 pm,32.4,0.37,4.8,0,32.35104,2005-01-28 16:00:00,28
28/01/05,5:00 pm,34.4,0.23,4.8,0,67.9716,2005-01-28 17:00:00,28
28/01/05,6:00 pm,34.7,0.31,6.4,0,44.82684,2005-01-28 18:00:00,28
28/01/05,7:00 pm,33.2,0.44,4.8,0,23.40288,2005-01-28 19:00:00,28
28/01/05,8:00 pm,28.5,0.59,3.2,0,4.12992,2005-01-28 20:00:00,28
28/01/05,9:00 pm,25.7,0.56,4.8,0,0.17208,2005-01-28 21:00:00,28
28/01/05,10:00 pm,23.8,0.53,4.8,0,0,2005-01-28 22:00:00,28
28/01/05,11:00 pm,22.9,0.72,3.2,0,0,2005-01-28 23:00:00,28
29/01/05,12:00 am,21.7,0.68,3.2,0,0,2005-01-29 00:00:00,29
29/01/05,1:00 am,23.7,0.72,6.4,0,0,2005-01-29 01:00:00,29
29/01/05,2:00 am,23,0.8,4.8,0,0,2005-01-29 02:00:00,29
29/01/05,3:00 am,21.6,0.81,3.2,0,0,2005-01-29 03:00:00,29
29/01/05,4:00 am,22.1,0.85,4.8,0,0,2005-01-29 04:00:00,29
29/01/05,5:00 am,21.1,0.87,4.8,0,0,2005-01-29 05:00:00,29
29/01/05,6:00 am,21.2,0.84,6.4,0,0,2005-01-29 06:00:00,29
29/01/05,7:00 am,22.3,0.84,8,0,0.77436,2005-01-29 07:00:00,29
29/01/05,8:00 am,23.3,0.78,8,0,12.56184,2005-01-29 08:00:00,29
29/01/05,9:00 am,25.7,0.76,12.9,0,29.76984,2005-01-29 09:00:00,29
29/01/05,10:00 am,27.8,0.68,14.5,0,47.66616,2005-01-29 10:00:00,29
29/01/05,11:00 am,29.7,0.64,16.1,0,64.87416,2005-01-29 11:00:00,29
29/01/05,12:00 pm,31.4,0.57,12.9,0,77.26392,2005-01-29 12:00:00,29
29/01/05,1:00 pm,33.1,0.53,12.9,0,83.37276,2005-01-29 13:00:00,29
29/01/05,2:00 pm,34.5,0.47,12.9,0,85.43772,2005-01-29 14:00:00,29
29/01/05,3:00 pm,35.7,0.4,12.9,0,82.25424,2005-01-29 15:00:00,29
29/01/05,4:00 pm,36.4,0.36,12.9,0,75.02688,2005-01-29 16:00:00,29
29/01/05,5:00 pm,36.7,0.33,12.9,0,64.01376,2005-01-29 17:00:00,29
29/01/05,6:00 pm,36.5,0.31,12.9,0,46.0314,2005-01-29 18:00:00,29
29/01/05,7:00 pm,35.2,0.46,16.1,0,25.63992,2005-01-29 19:00:00,29
29/01/05,8:00 pm,33.5,0.52,14.5,0,7.22736,2005-01-29 20:00:00,29
29/01/05,9:00 pm,31.7,0.58,12.9,0,0.08604,2005-01-29 21:00:00,29
29/01/05,10:00 pm,30.9,0.6,16.1,0,0,2005-01-29 22:00:00,29
29/01/05,11:00 pm,30.6,0.6,12.9,0,0,2005-01-29 23:00:00,29
30/01/05,12:00 am,30.3,0.6,14.5,0,0,2005-01-30 00:00:00,30
30/01/05,1:00 am,29.7,0.64,16.1,0,0,2005-01-30 01:00:00,30
30/01/05,2:00 am,29.1,0.68,14.5,0,0,2005-01-30 02:00:00,30
30/01/05,3:00 am,28.2,0.73,17.7,0,0,2005-01-30 03:00:00,30
30/01/05,4:00 am,22.7,0.94,24.1,3.581,0,2005-01-30 04:00:00,30
30/01/05,5:00 am,20.2,0.94,17.7,1.219,0,2005-01-30 05:00:00,30
30/01/05,6:00 am,20.3,0.94,12.9,0.127,0,2005-01-30 06:00:00,30
30/01/05,7:00 am,20.4,0.94,6.4,0,0,2005-01-30 07:00:00,30
30/01/05,8:00 am,20.4,0.93,3.2,0.559,0.8604,2005-01-30 08:00:00,30
30/01/05,9:00 am,18.9,0.94,11.3,0.533,4.90428,2005-01-30 09:00:00,30
30/01/05,10:00 am,18.1,0.95,11.3,0.102,3.8718,2005-01-30 10:00:00,30
30/01/05,11:00 am,17.7,0.95,14.5,0.127,8.51796,2005-01-30 11:00:00,30
30/01/05,12:00 pm,17.3,0.94,16.1,0.076,13.7664,2005-01-30 12:00:00,30
30/01/05,1:00 pm,17.1,0.95,14.5,0.102,6.8832,2005-01-30 13:00:00,30
30/01/05,2:00 pm,16.7,0.95,14.5,0.076,3.0114,2005-01-30 14:00:00,30
30/01/05,3:00 pm,16.7,0.96,14.5,0.406,2.06496,2005-01-30 15:00:00,30
30/01/05,4:00 pm,17.4,0.95,12.9,0.127,12.64788,2005-01-30 16:00:00,30
30/01/05,5:00 pm,17.9,0.94,12.9,0.051,6.79716,2005-01-30 17:00:00,30
30/01/05,6:00 pm,18.1,0.94,12.9,0,6.0228,2005-01-30 18:00:00,30
30/01/05,7:00 pm,17.9,0.94,14.5,0.025,3.09744,2005-01-30 19:00:00,30
30/01/05,8:00 pm,17.9,0.96,12.9,0,0.94644,2005-01-30 20:00:00,30
30/01/05,9:00 pm,17.8,0.94,11.3,0,0,2005-01-30 21:00:00,30
30/01/05,10:00 pm,17.9,0.94,11.3,0,0,2005-01-30 22:00:00,30
30/01/05,11:00 pm,18.2,0.95,9.7,1.118,0,2005-01-30 23:00:00,30
31/01/05,12:00 am,18.4,0.95,11.3,0.584,0,2005-01-31 00:00:00,31
31/01/05,1:00 am,18.1,0.94,16.1,0,0,2005-01-31 01:00:00,31
31/01/05,2:00 am,17.3,0.94,17.7,0.432,0,2005-01-31 02:00:00,31
31/01/05,3:00 am,16.7,0.94,19.3,1.448,0,2005-01-31 03:00:00,31
31/01/05,4:00 am,15.9,0.94,20.9,0.61,0,2005-01-31 04:00:00,31
31/01/05,5:00 am,15.5,0.94,20.9,0.051,0,2005-01-31 05:00:00,31
31/01/05,6:00 am,15.1,0.94,22.5,0.381,0,2005-01-31 06:00:00,31
31/01/05,7:00 am,14.6,0.93,20.9,0,0.17208,2005-01-31 07:00:00,31
31/01/05,8:00 am,14.1,0.92,22.5,0,1.37664,2005-01-31 08:00:00,31
31/01/05,9:00 am,14.2,0.91,22.5,0,7.39944,2005-01-31 09:00:00,31
31/01/05,10:00 am,15.3,0.86,20.9,0,20.2194,2005-01-31 10:00:00,31
31/01/05,11:00 am,16.8,0.85,20.9,0,32.09292,2005-01-31 11:00:00,31
31/01/05,12:00 pm,18.1,0.79,22.5,0,48.87072,2005-01-31 12:00:00,31
31/01/05,1:00 pm,17.3,0.82,20.9,0,24.0912,2005-01-31 13:00:00,31
31/01/05,2:00 pm,16.8,0.82,22.5,0,32.265,2005-01-31 14:00:00,31
31/01/05,3:00 pm,16.2,0.8,22.5,0,27.70488,2005-01-31 15:00:00,31
31/01/05,4:00 pm,16.9,0.76,22.5,0,32.52312,2005-01-31 16:00:00,31
31/01/05,5:00 pm,17.7,0.72,20.9,0,25.03764,2005-01-31 17:00:00,31
31/01/05,6:00 pm,17.6,0.7,20.9,0,18.67068,2005-01-31 18:00:00,31
31/01/05,7:00 pm,17.6,0.73,17.7,0,13.25016,2005-01-31 19:00:00,31
31/01/05,8:00 pm,16.9,0.76,16.1,0,3.8718,2005-01-31 20:00:00,31
31/01/05,9:00 pm,15.4,0.83,9.7,0,0.17208,2005-01-31 21:00:00,31
31/01/05,10:00 pm,14.4,0.85,8,0,0,2005-01-31 22:00:00,31
31/01/05,11:00 pm,12.8,0.91,1.6,0,0,2005-01-31 23:00:00,31
01/02/05,12:00 am,11.9,0.92,0,0,0,2005-02-01 00:00:00,32
01/02/05,1:00 am,11,0.93,1.6,0,0,2005-02-01 01:00:00,32
01/02/05,2:00 am,10.9,0.94,3.2,0,0,2005-02-01 02:00:00,32
01/02/05,3:00 am,11.5,0.92,4.8,0,0,2005-02-01 03:00:00,32
01/02/05,4:00 am,11.7,0.92,8,0,0,2005-02-01 04:00:00,32
01/02/05,5:00 am,11.4,0.91,6.4,0,0,2005-02-01 05:00:00,32
01/02/05,6:00 am,11,0.92,6.4,0,0,2005-02-01 06:00:00,32
01/02/05,7:00 am,10.7,0.92,8,0,0.77436,2005-02-01 07:00:00,32
01/02/05,8:00 am,11.9,0.87,9.7,0,15.31512,2005-02-01 08:00:00,32
01/02/05,9:00 am,14.4,0.8,9.7,0,32.95332,2005-02-01 09:00:00,32
01/02/05,10:00 am,16.4,0.73,11.3,0.051,52.31232,2005-02-01 10:00:00,32
01/02/05,11:00 am,18.1,0.64,11.3,0,71.58528,2005-02-01 11:00:00,32
01/02/05,12:00 pm,19.6,0.56,11.3,0,82.1682,2005-02-01 12:00:00,32
01/02/05,1:00 pm,20.5,0.55,12.9,0,91.03032,2005-02-01 13:00:00,32
01/02/05,2:00 pm,21,0.53,12.9,0,95.16024,2005-02-01 14:00:00,32
01/02/05,3:00 pm,20.7,0.56,12.9,0,34.76016,2005-02-01 15:00:00,32
01/02/05,4:00 pm,19.2,0.56,9.7,0,25.98408,2005-02-01 16:00:00,32
01/02/05,5:00 pm,18.9,0.59,11.3,0,21.25188,2005-02-01 17:00:00,32
01/02/05,6:00 pm,18.7,0.62,8,0,17.29404,2005-02-01 18:00:00,32
01/02/05,7:00 pm,18.3,0.69,4.8,0,9.8946,2005-02-01 19:00:00,32
01/02/05,8:00 pm,17.5,0.82,0,0,3.26952,2005-02-01 20:00:00,32
01/02/05,9:00 pm,16.3,0.88,0,0,0.17208,2005-02-01 21:00:00,32
01/02/05,10:00 pm,15.9,0.82,1.6,0,0,2005-02-01 22:00:00,32
01/02/05,11:00 pm,15.7,0.83,1.6,0,0,2005-02-01 23:00:00,32
02/02/05,12:00 am,15.5,0.8,3.2,0,0,2005-02-02 00:00:00,33
02/02/05,1:00 am,14.8,0.84,3.2,0,0,2005-02-02 01:00:00,33
02/02/05,2:00 am,14.3,0.85,1.6,0,0,2005-02-02 02:00:00,33
02/02/05,3:00 am,14.2,0.84,3.2,0,0,2005-02-02 03:00:00,33
02/02/05,4:00 am,14,0.86,1.6,0,0,2005-02-02 04:00:00,33
02/02/05,5:00 am,14.1,0.86,3.2,0,0,2005-02-02 05:00:00,33
02/02/05,6:00 am,13.9,0.89,1.6,0,0,2005-02-02 06:00:00,33
02/02/05,7:00 am,13.6,0.9,1.6,0,0.60228,2005-02-02 07:00:00,33
02/02/05,8:00 am,14.4,0.83,1.6,0,6.71112,2005-02-02 08:00:00,33
02/02/05,9:00 am,16.2,0.69,4.8,0,20.30544,2005-02-02 09:00:00,33
02/02/05,10:00 am,18,0.63,9.7,0,35.36244,2005-02-02 10:00:00,33
02/02/05,11:00 am,18.4,0.63,11.3,0,36.30888,2005-02-02 11:00:00,33
02/02/05,12:00 pm,19.1,0.57,9.7,0,44.99892,2005-02-02 12:00:00,33
02/02/05,1:00 pm,18.9,0.64,8,0.051,37.94364,2005-02-02 13:00:00,33
02/02/05,2:00 pm,19.7,0.55,8,0,51.96816,2005-02-02 14:00:00,33
02/02/05,3:00 pm,20.6,0.56,8,0,52.74252,2005-02-02 15:00:00,33
02/02/05,4:00 pm,21.1,0.54,6.4,0,47.322,2005-02-02 16:00:00,33
02/02/05,5:00 pm,21.2,0.51,6.4,0,37.77156,2005-02-02 17:00:00,33
02/02/05,6:00 pm,20.4,0.63,4.8,0,18.84276,2005-02-02 18:00:00,33
02/02/05,7:00 pm,19.5,0.72,3.2,0,9.55044,2005-02-02 19:00:00,33
02/02/05,8:00 pm,18.5,0.82,0,0,3.09744,2005-02-02 20:00:00,33
02/02/05,9:00 pm,17.3,0.86,0,0,0.08604,2005-02-02 21:00:00,33
02/02/05,10:00 pm,16.6,0.86,0,0,0,2005-02-02 22:00:00,33
02/02/05,11:00 pm,15.7,0.88,0,0,0,2005-02-02 23:00:00,33
03/02/05,12:00 am,14.9,0.92,0,0,0,2005-02-03 00:00:00,34
03/02/05,1:00 am,15,0.92,0,0,0,2005-02-03 01:00:00,34
03/02/05,2:00 am,14.7,0.93,0,0,0,2005-02-03 02:00:00,34
03/02/05,3:00 am,14.3,0.9,0,0,0,2005-02-03 03:00:00,34
03/02/05,4:00 am,13.7,0.88,1.6,0,0,2005-02-03 04:00:00,34
03/02/05,5:00 am,12.6,0.91,0,0,0,2005-02-03 05:00:00,34
03/02/05,6:00 am,12,0.9,1.6,0,0,2005-02-03 06:00:00,34
03/02/05,7:00 am,12.1,0.92,1.6,0,0.60228,2005-02-03 07:00:00,34
03/02/05,8:00 am,13.4,0.91,1.6,0,6.53904,2005-02-03 08:00:00,34
03/02/05,9:00 am,16.8,0.75,4.8,0,26.6724,2005-02-03 09:00:00,34
03/02/05,10:00 am,20.7,0.66,8,0,51.88212,2005-02-03 10:00:00,34
03/02/05,11:00 am,23.2,0.56,6.4,0,68.57388,2005-02-03 11:00:00,34
03/02/05,12:00 pm,24.6,0.55,8,0,81.65196,2005-02-03 12:00:00,34
03/02/05,1:00 pm,25,0.52,9.7,0,91.54656,2005-02-03 13:00:00,34
03/02/05,2:00 pm,26.1,0.48,6.4,0,93.95568,2005-02-03 14:00:00,34
03/02/05,3:00 pm,26.4,0.58,6.4,0,77.60808,2005-02-03 15:00:00,34
03/02/05,4:00 pm,27.1,0.5,4.8,0,80.61948,2005-02-03 16:00:00,34
03/02/05,5:00 pm,27,0.62,6.4,0,65.30436,2005-02-03 17:00:00,34
03/02/05,6:00 pm,25.7,0.56,6.4,0,36.39492,2005-02-03 18:00:00,34
03/02/05,7:00 pm,25.8,0.56,4.8,0,25.72596,2005-02-03 19:00:00,34
03/02/05,8:00 pm,23.4,0.74,1.6,0,7.48548,2005-02-03 20:00:00,34
03/02/05,9:00 pm,19.9,0.84,1.6,0,0.17208,2005-02-03 21:00:00,34
03/02/05,10:00 pm,18.6,0.85,0,0,0,2005-02-03 22:00:00,34
03/02/05,11:00 pm,17.9,0.9,0,0,0,2005-02-03 23:00:00,34
04/02/05,12:00 am,17.3,0.9,0,0,0,2005-02-04 00:00:00,35
04/02/05,1:00 am,16.2,0.93,0,0,0,2005-02-04 01:00:00,35
04/02/05,2:00 am,15.8,0.94,0,0,0,2005-02-04 02:00:00,35
04/02/05,3:00 am,16.7,0.95,0,0,0,2005-02-04 03:00:00,35
04/02/05,4:00 am,17.7,0.93,0,0,0,2005-02-04 04:00:00,35
04/02/05,5:00 am,18.4,0.92,0,0,0,2005-02-04 05:00:00,35
04/02/05,6:00 am,18.8,0.92,0,0,0,2005-02-04 06:00:00,35
04/02/05,7:00 am,18.9,0.9,1.6,0,0.34416,2005-02-04 07:00:00,35
04/02/05,8:00 am,19.3,0.88,1.6,0,5.50656,2005-02-04 08:00:00,35
04/02/05,9:00 am,21.4,0.74,3.2,0,26.58636,2005-02-04 09:00:00,35
04/02/05,10:00 am,24.4,0.62,6.4,0,49.21488,2005-02-04 10:00:00,35
04/02/05,11:00 am,25.7,0.67,8,0,65.3904,2005-02-04 11:00:00,35
04/02/05,12:00 pm,26.3,0.66,8,0,71.49924,2005-02-04 12:00:00,35
04/02/05,1:00 pm,26.8,0.67,8,0,88.27704,2005-02-04 13:00:00,35
04/02/05,2:00 pm,27.1,0.61,8,0,89.30952,2005-02-04 14:00:00,35
04/02/05,3:00 pm,27.7,0.56,6.4,0,85.86792,2005-02-04 15:00:00,35
04/02/05,4:00 pm,28.1,0.53,8,0,75.88728,2005-02-04 16:00:00,35
04/02/05,5:00 pm,28.1,0.53,9.7,0,61.34652,2005-02-04 17:00:00,35
04/02/05,6:00 pm,27.9,0.59,8,0,44.22456,2005-02-04 18:00:00,35
04/02/05,7:00 pm,27.2,0.64,6.4,0,24.69348,2005-02-04 19:00:00,35
04/02/05,8:00 pm,25,0.79,3.2,0,7.14132,2005-02-04 20:00:00,35
04/02/05,9:00 pm,22.1,0.83,0,0,0.17208,2005-02-04 21:00:00,35
04/02/05,10:00 pm,20.8,0.85,0,0,0,2005-02-04 22:00:00,35
04/02/05,11:00 pm,20,0.86,1.6,0,0,2005-02-04 23:00:00,35
05/02/05,12:00 am,19.6,0.88,1.6,0,0,2005-02-05 00:00:00,36
05/02/05,1:00 am,19.1,0.88,1.6,0,0,2005-02-05 01:00:00,36
05/02/05,2:00 am,18.7,0.89,1.6,0,0,2005-02-05 02:00:00,36
05/02/05,3:00 am,18.8,0.89,1.6,0,0,2005-02-05 03:00:00,36
05/02/05,4:00 am,18.2,0.89,0,0,0,2005-02-05 04:00:00,36
05/02/05,5:00 am,17.7,0.89,0,0,0,2005-02-05 05:00:00,36
05/02/05,6:00 am,17.4,0.9,0,0,0,2005-02-05 06:00:00,36
05/02/05,7:00 am,17.3,0.92,0,0,0.68832,2005-02-05 07:00:00,36
05/02/05,8:00 am,19.1,0.84,0,0,9.80856,2005-02-05 08:00:00,36
05/02/05,9:00 am,22.6,0.81,3.2,0,24.9516,2005-02-05 09:00:00,36
05/02/05,10:00 am,25.3,0.7,6.4,0,49.473,2005-02-05 10:00:00,36
05/02/05,11:00 am,27.9,0.67,4.8,0,66.16476,2005-02-05 11:00:00,36
05/02/05,12:00 pm,29.3,0.64,8,0,77.8662,2005-02-05 12:00:00,36
05/02/05,1:00 pm,30.7,0.54,4.8,0,85.6098,2005-02-05 13:00:00,36
05/02/05,2:00 pm,31.6,0.61,4.8,0,89.0514,2005-02-05 14:00:00,36
05/02/05,3:00 pm,32.3,0.56,4.8,0,85.00752,2005-02-05 15:00:00,36
05/02/05,4:00 pm,32.1,0.63,6.4,0,76.83372,2005-02-05 16:00:00,36
05/02/05,5:00 pm,31.6,0.67,4.8,0,46.8918,2005-02-05 17:00:00,36
05/02/05,6:00 pm,30.7,0.66,4.8,0,30.45816,2005-02-05 18:00:00,36
05/02/05,7:00 pm,30.1,0.66,4.8,0,22.28436,2005-02-05 19:00:00,36
05/02/05,8:00 pm,29.3,0.74,6.4,0,9.80856,2005-02-05 20:00:00,36
05/02/05,9:00 pm,27.1,0.8,4.8,0,0.25812,2005-02-05 21:00:00,36
05/02/05,10:00 pm,26.1,0.83,3.2,0,0,2005-02-05 22:00:00,36
05/02/05,11:00 pm,25.4,0.85,3.2,0,0,2005-02-05 23:00:00,36
06/02/05,12:00 am,24.7,0.86,3.2,0,0,2005-02-06 00:00:00,37
06/02/05,1:00 am,24.6,0.88,4.8,0,0,2005-02-06 01:00:00,37
06/02/05,2:00 am,24.5,0.88,4.8,0,0,2005-02-06 02:00:00,37
06/02/05,3:00 am,24.3,0.87,4.8,0,0,2005-02-06 03:00:00,37
06/02/05,4:00 am,24.2,0.88,6.4,0,0,2005-02-06 04:00:00,37
06/02/05,5:00 am,24,0.88,6.4,0,0,2005-02-06 05:00:00,37
06/02/05,6:00 am,24.3,0.85,6.4,0,0,2005-02-06 06:00:00,37
06/02/05,7:00 am,24.4,0.87,6.4,0,0.25812,2005-02-06 07:00:00,37
06/02/05,8:00 am,24.5,0.84,8,0,2.66724,2005-02-06 08:00:00,37
06/02/05,9:00 am,25.2,0.83,9.7,0,7.57152,2005-02-06 09:00:00,37
06/02/05,10:00 am,25.4,0.84,9.7,0,7.91568,2005-02-06 10:00:00,37
06/02/05,11:00 am,26.1,0.84,8,0,14.79888,2005-02-06 11:00:00,37
06/02/05,12:00 pm,26.8,0.84,6.4,0,17.208,2005-02-06 12:00:00,37
06/02/05,1:00 pm,27.7,0.79,3.2,0,22.45644,2005-02-06 13:00:00,37
06/02/05,2:00 pm,28.9,0.79,4.8,0,30.5442,2005-02-06 14:00:00,37
06/02/05,3:00 pm,29.4,0.77,4.8,0,30.20004,2005-02-06 15:00:00,37
06/02/05,4:00 pm,29.3,0.85,1.6,0,14.45472,2005-02-06 16:00:00,37
06/02/05,5:00 pm,27.2,0.9,1.6,0.127,0.51624,2005-02-06 17:00:00,37
06/02/05,6:00 pm,24.7,0.92,6.4,0.279,0.60228,2005-02-06 18:00:00,37
06/02/05,7:00 pm,23.3,0.93,1.6,0.076,4.04388,2005-02-06 19:00:00,37
06/02/05,8:00 pm,23.3,0.94,1.6,0.127,0.4302,2005-02-06 20:00:00,37
06/02/05,9:00 pm,22.9,0.94,1.6,0.178,0,2005-02-06 21:00:00,37
06/02/05,10:00 pm,22.6,0.94,1.6,0.025,0,2005-02-06 22:00:00,37
06/02/05,11:00 pm,22.5,0.95,1.6,0,0,2005-02-06 23:00:00,37
07/02/05,12:00 am,22.8,0.94,3.2,0.025,0,2005-02-07 00:00:00,38
07/02/05,1:00 am,23.3,0.9,8,0,0,2005-02-07 01:00:00,38
07/02/05,2:00 am,22.3,0.9,9.7,0,0,2005-02-07 02:00:00,38
07/02/05,3:00 am,21.8,0.91,4.8,0,0,2005-02-07 03:00:00,38
07/02/05,4:00 am,22.5,0.91,6.4,0,0,2005-02-07 04:00:00,38
07/02/05,5:00 am,22.4,0.93,4.8,0,0,2005-02-07 05:00:00,38
07/02/05,6:00 am,21.9,0.93,6.4,0,0,2005-02-07 06:00:00,38
07/02/05,7:00 am,21.9,0.94,3.2,0,0.17208,2005-02-07 07:00:00,38
07/02/05,8:00 am,22.4,0.93,3.2,0,3.61368,2005-02-07 08:00:00,38
07/02/05,9:00 am,23.5,0.9,3.2,0,8.69004,2005-02-07 09:00:00,38
07/02/05,10:00 am,24.1,0.89,4.8,0,10.755,2005-02-07 10:00:00,38
07/02/05,11:00 am,23.9,0.9,4.8,0,6.79716,2005-02-07 11:00:00,38
07/02/05,12:00 pm,23.8,0.89,3.2,0,8.25984,2005-02-07 12:00:00,38
07/02/05,1:00 pm,23.3,0.93,4.8,0.584,4.7322,2005-02-07 13:00:00,38
07/02/05,2:00 pm,22.8,0.93,6.4,0.406,5.24844,2005-02-07 14:00:00,38
07/02/05,3:00 pm,22.9,0.94,8,0.152,6.62508,2005-02-07 15:00:00,38
07/02/05,4:00 pm,23.2,0.93,3.2,0.076,3.8718,2005-02-07 16:00:00,38
07/02/05,5:00 pm,23.5,0.94,3.2,0.051,7.48548,2005-02-07 17:00:00,38
07/02/05,6:00 pm,24.3,0.91,4.8,0,16.43364,2005-02-07 18:00:00,38
07/02/05,7:00 pm,24.8,0.9,4.8,0,14.28264,2005-02-07 19:00:00,38
07/02/05,8:00 pm,24.3,0.91,1.6,0,5.24844,2005-02-07 20:00:00,38
07/02/05,9:00 pm,23.1,0.93,0,0,0,2005-02-07 21:00:00,38
07/02/05,10:00 pm,21.6,0.95,0,0,0,2005-02-07 22:00:00,38
07/02/05,11:00 pm,21.4,0.95,1.6,0,0,2005-02-07 23:00:00,38
08/02/05,12:00 am,21.1,0.95,1.6,0,0,2005-02-08 00:00:00,39
08/02/05,1:00 am,21.2,0.96,3.2,0,0,2005-02-08 01:00:00,39
08/02/05,2:00 am,21.8,0.95,1.6,0,0,2005-02-08 02:00:00,39
08/02/05,3:00 am,21.8,0.95,0,0,0,2005-02-08 03:00:00,39
08/02/05,4:00 am,21.5,0.95,1.6,0,0,2005-02-08 04:00:00,39
08/02/05,5:00 am,21.7,0.95,1.6,0.127,0,2005-02-08 05:00:00,39
08/02/05,6:00 am,21.8,0.95,3.2,0.025,0,2005-02-08 06:00:00,39
08/02/05,7:00 am,21.8,0.95,1.6,0,0.08604,2005-02-08 07:00:00,39
08/02/05,8:00 am,22.1,0.95,3.2,1.549,1.11852,2005-02-08 08:00:00,39
08/02/05,9:00 am,22.1,0.95,6.4,1.803,0.8604,2005-02-08 09:00:00,39
08/02/05,10:00 am,21.6,0.94,8,0.838,1.03248,2005-02-08 10:00:00,39
08/02/05,11:00 am,21.4,0.95,1.6,0.305,1.03248,2005-02-08 11:00:00,39
08/02/05,12:00 pm,21.3,0.94,4.8,0.203,4.04388,2005-02-08 12:00:00,39
08/02/05,1:00 pm,21.7,0.94,6.4,0.229,10.49688,2005-02-08 13:00:00,39
08/02/05,2:00 pm,22.3,0.93,6.4,0.305,14.97096,2005-02-08 14:00:00,39
08/02/05,3:00 pm,22.7,0.92,8,0.076,20.47752,2005-02-08 15:00:00,39
08/02/05,4:00 pm,22.9,0.91,11.3,0,20.30544,2005-02-08 16:00:00,39
08/02/05,5:00 pm,23.2,0.88,12.9,0,23.31684,2005-02-08 17:00:00,39
08/02/05,6:00 pm,23.8,0.84,1.6,0,21.76812,2005-02-08 18:00:00,39
08/02/05,7:00 pm,24.2,0.86,3.2,0.025,13.93848,2005-02-08 19:00:00,39
08/02/05,8:00 pm,24.1,0.88,1.6,0,6.53904,2005-02-08 20:00:00,39
08/02/05,9:00 pm,22.4,0.93,0,0,0.08604,2005-02-08 21:00:00,39
08/02/05,10:00 pm,21.2,0.93,0,0,0,2005-02-08 22:00:00,39
08/02/05,11:00 pm,19.9,0.94,0,0,0,2005-02-08 23:00:00,39
09/02/05,12:00 am,18.9,0.94,0,0,0,2005-02-09 00:00:00,40
09/02/05,1:00 am,18.2,0.96,0,0,0,2005-02-09 01:00:00,40
09/02/05,2:00 am,17.8,0.96,0,0,0,2005-02-09 02:00:00,40
09/02/05,3:00 am,17.4,0.96,0,0,0,2005-02-09 03:00:00,40
09/02/05,4:00 am,17.4,0.96,0,0,0,2005-02-09 04:00:00,40
09/02/05,5:00 am,17.4,0.96,0,0,0,2005-02-09 05:00:00,40
09/02/05,6:00 am,17.8,0.96,0,0,0,2005-02-09 06:00:00,40
09/02/05,7:00 am,17.7,0.96,0,0,0.34416,2005-02-09 07:00:00,40
09/02/05,8:00 am,18.7,0.96,0,0,11.70144,2005-02-09 08:00:00,40
09/02/05,9:00 am,22.2,0.94,0,0,29.08152,2005-02-09 09:00:00,40
09/02/05,10:00 am,25.1,0.79,1.6,0,47.322,2005-02-09 10:00:00,40
09/02/05,11:00 am,27.3,0.78,3.2,0,62.89524,2005-02-09 11:00:00,40
09/02/05,12:00 pm,28.8,0.71,3.2,0,76.83372,2005-02-09 12:00:00,40
09/02/05,1:00 pm,29.9,0.7,3.2,0,88.27704,2005-02-09 13:00:00,40
09/02/05,2:00 pm,31.1,0.68,1.6,0,98.77392,2005-02-09 14:00:00,40
09/02/05,3:00 pm,31,0.64,3.2,0,62.8092,2005-02-09 15:00:00,40
09/02/05,4:00 pm,32.1,0.6,1.6,0,65.56248,2005-02-09 16:00:00,40
09/02/05,5:00 pm,32.4,0.58,1.6,0,61.43256,2005-02-09 17:00:00,40
09/02/05,6:00 pm,32.1,0.66,3.2,0,44.65476,2005-02-09 18:00:00,40
09/02/05,7:00 pm,30.8,0.73,3.2,0,23.74704,2005-02-09 19:00:00,40
09/02/05,8:00 pm,29.4,0.81,0,0,6.36696,2005-02-09 20:00:00,40
09/02/05,9:00 pm,25.4,0.88,0,0,0.08604,2005-02-09 21:00:00,40
09/02/05,10:00 pm,23.6,0.9,0,0,0,2005-02-09 22:00:00,40
09/02/05,11:00 pm,22.3,0.92,0,0,0,2005-02-09 23:00:00,40
10/02/05,12:00 am,21.6,0.92,0,0,0,2005-02-10 00:00:00,41
10/02/05,1:00 am,21.5,0.94,0,0,0,2005-02-10 01:00:00,41
10/02/05,2:00 am,21.9,0.92,1.6,0,0,2005-02-10 02:00:00,41
10/02/05,3:00 am,22.7,0.91,3.2,0,0,2005-02-10 03:00:00,41
10/02/05,4:00 am,22.5,0.91,4.8,0,0,2005-02-10 04:00:00,41
10/02/05,5:00 am,21.9,0.91,8,0,0,2005-02-10 05:00:00,41
10/02/05,6:00 am,21.3,0.9,9.7,0,0,2005-02-10 06:00:00,41
10/02/05,7:00 am,20.8,0.91,9.7,0,0.34416,2005-02-10 07:00:00,41
10/02/05,8:00 am,21.1,0.88,8,0,11.70144,2005-02-10 08:00:00,41
10/02/05,9:00 am,22.6,0.81,8,0,29.08152,2005-02-10 09:00:00,41
10/02/05,10:00 am,24.2,0.75,11.3,0,47.14992,2005-02-10 10:00:00,41
10/02/05,11:00 am,25.4,0.73,12.9,0,63.6696,2005-02-10 11:00:00,41
10/02/05,12:00 pm,26.3,0.73,14.5,0,76.66164,2005-02-10 12:00:00,41
10/02/05,1:00 pm,27.1,0.7,14.5,0,85.00752,2005-02-10 13:00:00,41
10/02/05,2:00 pm,27.5,0.65,14.5,0,90.51408,2005-02-10 14:00:00,41
10/02/05,3:00 pm,27.8,0.7,14.5,0,91.80468,2005-02-10 15:00:00,41
10/02/05,4:00 pm,27.3,0.67,14.5,0,70.5528,2005-02-10 16:00:00,41
10/02/05,5:00 pm,26.4,0.68,14.5,0,53.00064,2005-02-10 17:00:00,41
10/02/05,6:00 pm,26.1,0.66,12.9,0,44.13852,2005-02-10 18:00:00,41
10/02/05,7:00 pm,25.2,0.69,12.9,0,24.69348,2005-02-10 19:00:00,41
10/02/05,8:00 pm,23.2,0.78,9.7,0,6.10884,2005-02-10 20:00:00,41
10/02/05,9:00 pm,20.4,0.85,6.4,0,0.08604,2005-02-10 21:00:00,41
10/02/05,10:00 pm,19.3,0.87,6.4,0,0,2005-02-10 22:00:00,41
10/02/05,11:00 pm,18.6,0.87,6.4,0,0,2005-02-10 23:00:00,41
11/02/05,12:00 am,17.9,0.89,3.2,0,0,2005-02-11 00:00:00,42
11/02/05,1:00 am,17.8,0.89,4.8,0,0,2005-02-11 01:00:00,42
11/02/05,2:00 am,17.6,0.89,4.8,0,0,2005-02-11 02:00:00,42
11/02/05,3:00 am,17.3,0.92,4.8,0,0,2005-02-11 03:00:00,42
11/02/05,4:00 am,17.2,0.91,6.4,0,0,2005-02-11 04:00:00,42
11/02/05,5:00 am,17.1,0.91,4.8,0,0,2005-02-11 05:00:00,42
11/02/05,6:00 am,16.9,0.92,4.8,0,0,2005-02-11 06:00:00,42
11/02/05,7:00 am,16.6,0.92,6.4,0,0.25812,2005-02-11 07:00:00,42
11/02/05,8:00 am,17.3,0.92,4.8,0,4.56012,2005-02-11 08:00:00,42
11/02/05,9:00 am,19.6,0.87,6.4,0,21.16584,2005-02-11 09:00:00,42
11/02/05,10:00 am,22.2,0.8,9.7,0,35.96472,2005-02-11 10:00:00,42
11/02/05,11:00 am,23.3,0.77,9.7,0,44.7408,2005-02-11 11:00:00,42
11/02/05,12:00 pm,23.8,0.78,9.7,0,38.2878,2005-02-11 12:00:00,42
11/02/05,1:00 pm,24.6,0.71,11.3,0,60.05592,2005-02-11 13:00:00,42
11/02/05,2:00 pm,24.4,0.71,11.3,0,53.08668,2005-02-11 14:00:00,42
11/02/05,3:00 pm,24.6,0.75,11.3,0,45.77328,2005-02-11 15:00:00,42
11/02/05,4:00 pm,24.6,0.73,9.7,0,49.64508,2005-02-11 16:00:00,42
11/02/05,5:00 pm,24.9,0.71,11.3,0,58.9374,2005-02-11 17:00:00,42
11/02/05,6:00 pm,23.7,0.72,11.3,0,23.91912,2005-02-11 18:00:00,42
11/02/05,7:00 pm,22.4,0.74,9.7,0,10.49688,2005-02-11 19:00:00,42
11/02/05,8:00 pm,21.4,0.8,8,0,2.40912,2005-02-11 20:00:00,42
11/02/05,9:00 pm,20.7,0.82,4.8,0,0,2005-02-11 21:00:00,42
11/02/05,10:00 pm,19.2,0.89,1.6,0,0,2005-02-11 22:00:00,42
11/02/05,11:00 pm,17.7,0.91,1.6,0,0,2005-02-11 23:00:00,42
12/02/05,12:00 am,17.2,0.93,1.6,0,0,2005-02-12 00:00:00,43
12/02/05,1:00 am,18.4,0.91,4.8,0,0,2005-02-12 01:00:00,43
12/02/05,2:00 am,18.1,0.92,4.8,0,0,2005-02-12 02:00:00,43
12/02/05,3:00 am,18,0.92,6.4,0,0,2005-02-12 03:00:00,43
12/02/05,4:00 am,17.8,0.92,6.4,0,0,2005-02-12 04:00:00,43
12/02/05,5:00 am,18.2,0.93,6.4,0,0,2005-02-12 05:00:00,43
12/02/05,6:00 am,18.1,0.94,4.8,0,0,2005-02-12 06:00:00,43
12/02/05,7:00 am,17.9,0.94,4.8,0,0.34416,2005-02-12 07:00:00,43
12/02/05,8:00 am,19.1,0.89,4.8,0,12.30372,2005-02-12 08:00:00,43
12/02/05,9:00 am,21.1,0.83,9.7,0,29.6838,2005-02-12 09:00:00,43
12/02/05,10:00 am,22.4,0.81,11.3,0,47.83824,2005-02-12 10:00:00,43
12/02/05,11:00 am,23.8,0.74,11.3,0,64.9602,2005-02-12 11:00:00,43
12/02/05,12:00 pm,25,0.7,11.3,0,77.09184,2005-02-12 12:00:00,43
12/02/05,1:00 pm,25.8,0.68,9.7,0,83.889,2005-02-12 13:00:00,43
12/02/05,2:00 pm,26.4,0.68,11.3,0,87.93288,2005-02-12 14:00:00,43
12/02/05,3:00 pm,26.6,0.68,9.7,0,75.45708,2005-02-12 15:00:00,43
12/02/05,4:00 pm,26.8,0.67,8,0,62.20692,2005-02-12 16:00:00,43
12/02/05,5:00 pm,26.5,0.65,8,0,53.68896,2005-02-12 17:00:00,43
12/02/05,6:00 pm,26.6,0.66,6.4,0,38.89008,2005-02-12 18:00:00,43
12/02/05,7:00 pm,25.9,0.7,4.8,0,22.88664,2005-02-12 19:00:00,43
12/02/05,8:00 pm,24.1,0.82,1.6,0,5.33448,2005-02-12 20:00:00,43
12/02/05,9:00 pm,20.4,0.88,0,0,0,2005-02-12 21:00:00,43
12/02/05,10:00 pm,19.2,0.91,1.6,0,0,2005-02-12 22:00:00,43
12/02/05,11:00 pm,19.9,0.9,3.2,0,0,2005-02-12 23:00:00,43
13/02/05,12:00 am,19.3,0.91,1.6,0,0,2005-02-13 00:00:00,44
13/02/05,1:00 am,18.7,0.93,1.6,0,0,2005-02-13 01:00:00,44
13/02/05,2:00 am,18.4,0.94,1.6,0,0,2005-02-13 02:00:00,44
13/02/05,3:00 am,18.8,0.94,1.6,0,0,2005-02-13 03:00:00,44
13/02/05,4:00 am,18.9,0.93,3.2,0,0,2005-02-13 04:00:00,44
13/02/05,5:00 am,18.9,0.93,3.2,0,0,2005-02-13 05:00:00,44
13/02/05,6:00 am,18.4,0.94,3.2,0,0,2005-02-13 06:00:00,44
13/02/05,7:00 am,18.2,0.95,3.2,0,0.34416,2005-02-13 07:00:00,44
13/02/05,8:00 am,19.4,0.91,3.2,0,10.15272,2005-02-13 08:00:00,44
13/02/05,9:00 am,22.1,0.88,4.8,0,24.60744,2005-02-13 09:00:00,44
13/02/05,10:00 am,23.3,0.85,8,0,43.02,2005-02-13 10:00:00,44
13/02/05,11:00 am,25.1,0.8,8,0,66.681,2005-02-13 11:00:00,44
13/02/05,12:00 pm,26.6,0.7,6.4,0,77.69412,2005-02-13 12:00:00,44
13/02/05,1:00 pm,27.4,0.71,6.4,0,71.8434,2005-02-13 13:00:00,44
13/02/05,2:00 pm,28.4,0.65,4.8,0,90.25596,2005-02-13 14:00:00,44
13/02/05,3:00 pm,28.9,0.68,4.8,0,71.67132,2005-02-13 15:00:00,44
13/02/05,4:00 pm,29.2,0.69,8,0,78.21036,2005-02-13 16:00:00,44
13/02/05,5:00 pm,28.6,0.67,8,0,56.27016,2005-02-13 17:00:00,44
13/02/05,6:00 pm,28.3,0.66,8,0,42.93396,2005-02-13 18:00:00,44
13/02/05,7:00 pm,27.6,0.69,6.4,0,22.8006,2005-02-13 19:00:00,44
13/02/05,8:00 pm,25.6,0.82,3.2,0,5.5926,2005-02-13 20:00:00,44
13/02/05,9:00 pm,22.5,0.88,1.6,0,0.08604,2005-02-13 21:00:00,44
13/02/05,10:00 pm,21.4,0.9,1.6,0,0,2005-02-13 22:00:00,44
13/02/05,11:00 pm,20.1,0.92,0,0,0,2005-02-13 23:00:00,44
14/02/05,12:00 am,19.6,0.92,0,0,0,2005-02-14 00:00:00,45
14/02/05,1:00 am,18.9,0.93,0,0,0,2005-02-14 01:00:00,45
14/02/05,2:00 am,18.6,0.94,0,0,0,2005-02-14 02:00:00,45
14/02/05,3:00 am,18.6,0.95,0,0,0,2005-02-14 03:00:00,45
14/02/05,4:00 am,18.6,0.94,0,0,0,2005-02-14 04:00:00,45
14/02/05,5:00 am,18.8,0.94,1.6,0,0,2005-02-14 05:00:00,45
14/02/05,6:00 am,18.5,0.94,0,0,0,2005-02-14 06:00:00,45
14/02/05,7:00 am,18,0.95,0,0,0.25812,2005-02-14 07:00:00,45
14/02/05,8:00 am,19.7,0.9,1.6,0,10.06668,2005-02-14 08:00:00,45
14/02/05,9:00 am,23.4,0.81,4.8,0,27.963,2005-02-14 09:00:00,45
14/02/05,10:00 am,25.3,0.74,8,0,46.37556,2005-02-14 10:00:00,45
14/02/05,11:00 am,26.9,0.7,9.7,0,63.06732,2005-02-14 11:00:00,45
14/02/05,12:00 pm,28.5,0.71,6.4,0,75.7152,2005-02-14 12:00:00,45
14/02/05,1:00 pm,29.4,0.66,4.8,0,85.1796,2005-02-14 13:00:00,45
14/02/05,2:00 pm,29.9,0.6,4.8,0,81.82404,2005-02-14 14:00:00,45
14/02/05,3:00 pm,29.8,0.63,8,0,57.81888,2005-02-14 15:00:00,45
14/02/05,4:00 pm,28.7,0.63,6.4,0,24.34932,2005-02-14 16:00:00,45
14/02/05,5:00 pm,29.6,0.61,8,0,57.81888,2005-02-14 17:00:00,45
14/02/05,6:00 pm,29.4,0.63,8,0,42.33168,2005-02-14 18:00:00,45
14/02/05,7:00 pm,28.7,0.68,4.8,0,22.97268,2005-02-14 19:00:00,45
14/02/05,8:00 pm,26.7,0.77,1.6,0,5.33448,2005-02-14 20:00:00,45
14/02/05,9:00 pm,23.7,0.83,1.6,0,0,2005-02-14 21:00:00,45
14/02/05,10:00 pm,22.9,0.85,1.6,0,0,2005-02-14 22:00:00,45
14/02/05,11:00 pm,22.2,0.86,3.2,0,0,2005-02-14 23:00:00,45
15/02/05,12:00 am,22.5,0.85,4.8,0,0,2005-02-15 00:00:00,46
15/02/05,1:00 am,21.9,0.89,1.6,0,0,2005-02-15 01:00:00,46
15/02/05,2:00 am,20.8,0.92,0,0,0,2005-02-15 02:00:00,46
15/02/05,3:00 am,19.9,0.92,0,0,0,2005-02-15 03:00:00,46
15/02/05,4:00 am,18.7,0.94,0,0,0,2005-02-15 04:00:00,46
15/02/05,5:00 am,18.4,0.94,1.6,0,0,2005-02-15 05:00:00,46
15/02/05,6:00 am,18.3,0.94,0,0,0,2005-02-15 06:00:00,46
15/02/05,7:00 am,17.9,0.95,0,0,0.17208,2005-02-15 07:00:00,46
15/02/05,8:00 am,19.9,0.89,3.2,0,5.50656,2005-02-15 08:00:00,46
15/02/05,9:00 am,23.3,0.78,0,0,32.09292,2005-02-15 09:00:00,46
15/02/05,10:00 am,25.2,0.75,0,0,45.171,2005-02-15 10:00:00,46
15/02/05,11:00 am,26.5,0.73,0,0,63.15336,2005-02-15 11:00:00,46
15/02/05,12:00 pm,27.6,0.75,0,0,76.40352,2005-02-15 12:00:00,46
15/02/05,1:00 pm,28.6,0.68,0,0,83.889,2005-02-15 13:00:00,46
15/02/05,2:00 pm,29.3,0.66,0,0,74.8548,2005-02-15 14:00:00,46
15/02/05,3:00 pm,29.9,0.6,0,0,88.87932,2005-02-15 15:00:00,46
15/02/05,4:00 pm,29.7,0.64,3.2,0,73.5642,2005-02-15 16:00:00,46
15/02/05,5:00 pm,28.8,0.65,4.8,0,52.82856,2005-02-15 17:00:00,46
15/02/05,6:00 pm,28.2,0.65,3.2,0,35.36244,2005-02-15 18:00:00,46
15/02/05,7:00 pm,26.1,0.74,0,0,12.38976,2005-02-15 19:00:00,46
15/02/05,8:00 pm,24.7,0.82,0,0,4.90428,2005-02-15 20:00:00,46
15/02/05,9:00 pm,22.2,0.88,0,0,0,2005-02-15 21:00:00,46
15/02/05,10:00 pm,21.1,0.88,0,0,0,2005-02-15 22:00:00,46
15/02/05,11:00 pm,21.4,0.84,0,0,0,2005-02-15 23:00:00,46
16/02/05,12:00 am,21.7,0.86,0,0,0,2005-02-16 00:00:00,47
16/02/05,1:00 am,21.1,0.9,0,0,0,2005-02-16 01:00:00,47
16/02/05,2:00 am,20.1,0.91,0,0,0,2005-02-16 02:00:00,47
16/02/05,3:00 am,18.8,0.94,0,0,0,2005-02-16 03:00:00,47
16/02/05,4:00 am,18.1,0.93,0,0,0,2005-02-16 04:00:00,47
16/02/05,5:00 am,17.8,0.94,0,0,0,2005-02-16 05:00:00,47
16/02/05,6:00 am,17.7,0.94,0,0,0,2005-02-16 06:00:00,47
16/02/05,7:00 am,17.5,0.95,0,0,0.8604,2005-02-16 07:00:00,47
16/02/05,8:00 am,19.1,0.95,0,0,4.56012,2005-02-16 08:00:00,47
16/02/05,9:00 am,20.9,0.89,0,0,10.3248,2005-02-16 09:00:00,47
16/02/05,10:00 am,23.7,0.75,0,0,45.34308,2005-02-16 10:00:00,47
16/02/05,11:00 am,26.1,0.63,0,0,55.40976,2005-02-16 11:00:00,47
16/02/05,12:00 pm,27.4,0.66,0,0,53.775,2005-02-16 12:00:00,47
16/02/05,1:00 pm,27.4,0.63,0,0,53.00064,2005-02-16 13:00:00,47
16/02/05,2:00 pm,28.6,0.64,0,0,80.4474,2005-02-16 14:00:00,47
16/02/05,3:00 pm,27.3,0.81,3.2,0.025,44.65476,2005-02-16 15:00:00,47
16/02/05,4:00 pm,26.2,0.81,1.6,0,19.53108,2005-02-16 16:00:00,47
16/02/05,5:00 pm,24.7,0.81,0,0,35.36244,2005-02-16 17:00:00,47
16/02/05,6:00 pm,25.1,0.78,0,0,26.75844,2005-02-16 18:00:00,47
16/02/05,7:00 pm,25.3,0.86,0,0,15.4872,2005-02-16 19:00:00,47
16/02/05,8:00 pm,23.2,0.88,0,0,3.61368,2005-02-16 20:00:00,47
16/02/05,9:00 pm,21.9,0.91,0,0,0,2005-02-16 21:00:00,47
16/02/05,10:00 pm,20.4,0.93,0,0,0,2005-02-16 22:00:00,47
16/02/05,11:00 pm,19.7,0.93,0,0,0,2005-02-16 23:00:00,47
17/02/05,12:00 am,19.3,0.94,0,0,0,2005-02-17 00:00:00,48
17/02/05,1:00 am,19.6,0.94,0,0,0,2005-02-17 01:00:00,48
17/02/05,2:00 am,19.4,0.92,0,0,0,2005-02-17 02:00:00,48
17/02/05,3:00 am,18.9,0.93,0,0,0,2005-02-17 03:00:00,48
17/02/05,4:00 am,18.1,0.94,0,0,0,2005-02-17 04:00:00,48
17/02/05,5:00 am,18.2,0.95,0,0,0,2005-02-17 05:00:00,48
17/02/05,6:00 am,18.5,0.94,0,0.025,0,2005-02-17 06:00:00,48
17/02/05,7:00 am,18.2,0.95,0,0,0.08604,2005-02-17 07:00:00,48
17/02/05,8:00 am,18.9,0.92,0,0,9.20628,2005-02-17 08:00:00,48
17/02/05,9:00 am,22,0.84,0,0,26.2422,2005-02-17 09:00:00,48
17/02/05,10:00 am,24.2,0.77,0,0,45.25704,2005-02-17 10:00:00,48
17/02/05,11:00 am,25.4,0.71,0,0,62.29296,2005-02-17 11:00:00,48
17/02/05,12:00 pm,26.6,0.7,0,0,77.60808,2005-02-17 12:00:00,48
17/02/05,1:00 pm,27.3,0.72,0,0,82.42632,2005-02-17 13:00:00,48
17/02/05,2:00 pm,27.6,0.64,0,0,83.4588,2005-02-17 14:00:00,48
17/02/05,3:00 pm,28.1,0.62,0,0,77.8662,2005-02-17 15:00:00,48
17/02/05,4:00 pm,27.9,0.64,0,0,70.29468,2005-02-17 16:00:00,48
17/02/05,5:00 pm,28.7,0.64,0,0,60.40008,2005-02-17 17:00:00,48
17/02/05,6:00 pm,28.4,0.65,0,0,41.12712,2005-02-17 18:00:00,48
17/02/05,7:00 pm,27.4,0.69,0,0,20.39148,2005-02-17 19:00:00,48
17/02/05,8:00 pm,26,0.82,0,0,4.64616,2005-02-17 20:00:00,48
17/02/05,9:00 pm,22.4,0.86,0,0,0,2005-02-17 21:00:00,48
17/02/05,10:00 pm,20.7,0.89,0,0,0,2005-02-17 22:00:00,48
17/02/05,11:00 pm,20.2,0.89,0,0,0,2005-02-17 23:00:00,48
18/02/05,12:00 am,19.7,0.92,0,0,0,2005-02-18 00:00:00,49
18/02/05,1:00 am,18.9,0.93,0,0,0,2005-02-18 01:00:00,49
18/02/05,2:00 am,18.4,0.94,0,0,0,2005-02-18 02:00:00,49
18/02/05,3:00 am,17.8,0.94,0,0,0,2005-02-18 03:00:00,49
18/02/05,4:00 am,17.6,0.94,0,0,0,2005-02-18 04:00:00,49
18/02/05,5:00 am,17.4,0.95,0,0,0,2005-02-18 05:00:00,49
18/02/05,6:00 am,17.2,0.95,0,0,0,2005-02-18 06:00:00,49
18/02/05,7:00 am,17.4,0.96,0,0,0.17208,2005-02-18 07:00:00,49
18/02/05,8:00 am,20.6,0.87,0,0,9.37836,2005-02-18 08:00:00,49
18/02/05,9:00 am,23.7,0.74,0,0,26.75844,2005-02-18 09:00:00,49
18/02/05,10:00 am,26.1,0.71,0,0,46.0314,2005-02-18 10:00:00,49
18/02/05,11:00 am,27.5,0.63,0,0,62.46504,2005-02-18 11:00:00,49
18/02/05,12:00 pm,28.8,0.67,0,0,75.02688,2005-02-18 12:00:00,49
18/02/05,1:00 pm,29.5,0.59,0,0,82.51236,2005-02-18 13:00:00,49
18/02/05,2:00 pm,30.1,0.6,0,0,84.7494,2005-02-18 14:00:00,49
18/02/05,3:00 pm,30.6,0.5,0,0,81.13572,2005-02-18 15:00:00,49
18/02/05,4:00 pm,30.6,0.52,0,0,72.10152,2005-02-18 16:00:00,49
18/02/05,5:00 pm,30.2,0.57,0,0,58.59324,2005-02-18 17:00:00,49
18/02/05,6:00 pm,29.7,0.56,0,0,40.869,2005-02-18 18:00:00,49
18/02/05,7:00 pm,28.4,0.64,0,0,21.76812,2005-02-18 19:00:00,49
18/02/05,8:00 pm,25.7,0.78,0,0,4.81824,2005-02-18 20:00:00,49
18/02/05,9:00 pm,22.7,0.84,0,0,0,2005-02-18 21:00:00,49
18/02/05,10:00 pm,21.3,0.88,0,0,0,2005-02-18 22:00:00,49
18/02/05,11:00 pm,20.4,0.89,0,0,0,2005-02-18 23:00:00,49
19/02/05,12:00 am,20.3,0.87,0,0,0,2005-02-19 00:00:00,50
19/02/05,1:00 am,21.2,0.89,0,0,0,2005-02-19 01:00:00,50
19/02/05,2:00 am,20.4,0.9,0,0,0,2005-02-19 02:00:00,50
19/02/05,3:00 am,19.2,0.91,0,0,0,2005-02-19 03:00:00,50
19/02/05,4:00 am,18.3,0.92,0,0,0,2005-02-19 04:00:00,50
19/02/05,5:00 am,18.7,0.92,0,0,0,2005-02-19 05:00:00,50
19/02/05,6:00 am,19.4,0.91,0,0,0,2005-02-19 06:00:00,50
19/02/05,7:00 am,19.1,0.89,0,0,0.17208,2005-02-19 07:00:00,50
19/02/05,8:00 am,20.3,0.84,0,0,9.98064,2005-02-19 08:00:00,50
19/02/05,9:00 am,23.7,0.73,3.2,0,27.79092,2005-02-19 09:00:00,50
19/02/05,10:00 am,25.7,0.67,6.4,0,46.20348,2005-02-19 10:00:00,50
19/02/05,11:00 am,27.6,0.68,3.2,0,56.7864,2005-02-19 11:00:00,50
19/02/05,12:00 pm,29.5,0.57,3.2,0,76.23144,2005-02-19 12:00:00,50
19/02/05,1:00 pm,30.6,0.6,3.2,0,83.54484,2005-02-19 13:00:00,50
19/02/05,2:00 pm,31.3,0.53,3.2,0,82.94256,2005-02-19 14:00:00,50
19/02/05,3:00 pm,31.5,0.59,3.2,0,77.34996,2005-02-19 15:00:00,50
19/02/05,4:00 pm,32.1,0.52,1.6,0,72.01548,2005-02-19 16:00:00,50
19/02/05,5:00 pm,32.1,0.59,1.6,0,57.73284,2005-02-19 17:00:00,50
19/02/05,6:00 pm,31.2,0.63,1.6,0,38.80404,2005-02-19 18:00:00,50
19/02/05,7:00 pm,28.7,0.71,0,0,14.02452,2005-02-19 19:00:00,50
19/02/05,8:00 pm,25.7,0.75,1.6,0,2.5812,2005-02-19 20:00:00,50
19/02/05,9:00 pm,23.8,0.78,0,0,0,2005-02-19 21:00:00,50
19/02/05,10:00 pm,22.1,0.85,0,0,0,2005-02-19 22:00:00,50
19/02/05,11:00 pm,21.8,0.83,0,0,0,2005-02-19 23:00:00,50
20/02/05,12:00 am,21.9,0.87,0,0,0,2005-02-20 00:00:00,51
20/02/05,1:00 am,22.2,0.89,0,0,0,2005-02-20 01:00:00,51
20/02/05,2:00 am,21.3,0.91,0,0,0,2005-02-20 02:00:00,51
20/02/05,3:00 am,20.7,0.9,0,0,0,2005-02-20 03:00:00,51
20/02/05,4:00 am,20.8,0.88,0,0,0,2005-02-20 04:00:00,51
20/02/05,5:00 am,21.8,0.85,1.6,0,0,2005-02-20 05:00:00,51
20/02/05,6:00 am,21.9,0.87,1.6,0,0,2005-02-20 06:00:00,51
20/02/05,7:00 am,21.4,0.89,0,0,0,2005-02-20 07:00:00,51
20/02/05,8:00 am,21.4,0.9,0,0,4.04388,2005-02-20 08:00:00,51
20/02/05,9:00 am,23.7,0.77,0,0,23.05872,2005-02-20 09:00:00,51
20/02/05,10:00 am,27,0.69,1.6,0,41.38524,2005-02-20 10:00:00,51
20/02/05,11:00 am,29.1,0.68,0,0,55.83996,2005-02-20 11:00:00,51
20/02/05,12:00 pm,30.7,0.6,0,0,61.34652,2005-02-20 12:00:00,51
20/02/05,1:00 pm,32.1,0.64,1.6,0,73.39212,2005-02-20 13:00:00,51
20/02/05,2:00 pm,32.2,0.48,1.6,0,71.32716,2005-02-20 14:00:00,51
20/02/05,3:00 pm,32.5,0.55,1.6,0,55.15164,2005-02-20 15:00:00,51
20/02/05,4:00 pm,32.2,0.63,1.6,0,40.78296,2005-02-20 16:00:00,51
20/02/05,5:00 pm,31.1,0.7,1.6,0,31.57668,2005-02-20 17:00:00,51
20/02/05,6:00 pm,29.7,0.72,1.6,0,21.33792,2005-02-20 18:00:00,51
20/02/05,7:00 pm,28.4,0.74,0,0,13.42224,2005-02-20 19:00:00,51
20/02/05,8:00 pm,26.4,0.85,0,0,3.35556,2005-02-20 20:00:00,51
20/02/05,9:00 pm,24.2,0.89,0,0,0,2005-02-20 21:00:00,51
20/02/05,10:00 pm,23.3,0.89,0,0,0,2005-02-20 22:00:00,51
20/02/05,11:00 pm,24,0.87,0,0,0,2005-02-20 23:00:00,51
21/02/05,12:00 am,25.6,0.85,1.6,0,0,2005-02-21 00:00:00,52
21/02/05,1:00 am,25.9,0.86,1.6,0,0,2005-02-21 01:00:00,52
21/02/05,2:00 am,25.6,0.87,0,0,0,2005-02-21 02:00:00,52
21/02/05,3:00 am,25.3,0.81,0,0,0,2005-02-21 03:00:00,52
21/02/05,4:00 am,24.6,0.86,0,0,0,2005-02-21 04:00:00,52
21/02/05,5:00 am,23.9,0.85,0,0,0,2005-02-21 05:00:00,52
21/02/05,6:00 am,23.6,0.89,0,0,0,2005-02-21 06:00:00,52
21/02/05,7:00 am,23.2,0.89,0,0,0,2005-02-21 07:00:00,52
21/02/05,8:00 am,23.1,0.88,0,0,0.94644,2005-02-21 08:00:00,52
21/02/05,9:00 am,23.4,0.87,0,0,3.35556,2005-02-21 09:00:00,52
21/02/05,10:00 am,23.1,0.87,0,0.051,6.36696,2005-02-21 10:00:00,52
21/02/05,11:00 am,23.5,0.87,0,0,8.25984,2005-02-21 11:00:00,52
21/02/05,12:00 pm,23.2,0.89,0,0.025,5.5926,2005-02-21 12:00:00,52
21/02/05,1:00 pm,22.3,0.89,0,0.025,4.38804,2005-02-21 13:00:00,52
21/02/05,2:00 pm,21.8,0.91,0,0.178,6.79716,2005-02-21 14:00:00,52
21/02/05,3:00 pm,22.4,0.9,0,0,12.13164,2005-02-21 15:00:00,52
21/02/05,4:00 pm,22.8,0.87,0,0,11.1852,2005-02-21 16:00:00,52
21/02/05,5:00 pm,23,0.92,0,0.025,7.57152,2005-02-21 17:00:00,52
21/02/05,6:00 pm,23.3,0.84,0,0,18.41256,2005-02-21 18:00:00,52
21/02/05,7:00 pm,23.6,0.86,0,0,12.56184,2005-02-21 19:00:00,52
21/02/05,8:00 pm,22.8,0.91,0,0,3.78576,2005-02-21 20:00:00,52
21/02/05,9:00 pm,20.9,0.93,0,0,0,2005-02-21 21:00:00,52
21/02/05,10:00 pm,19.3,0.94,0,0,0,2005-02-21 22:00:00,52
21/02/05,11:00 pm,18.6,0.95,0,0,0,2005-02-21 23:00:00,52
22/02/05,12:00 am,18.3,0.95,0,0,0,2005-02-22 00:00:00,53
22/02/05,1:00 am,17.8,0.95,0,0,0,2005-02-22 01:00:00,53
22/02/05,2:00 am,17.9,0.96,0,0,0,2005-02-22 02:00:00,53
22/02/05,3:00 am,17.7,0.96,0,0,0,2005-02-22 03:00:00,53
22/02/05,4:00 am,18.2,0.96,0,0,0,2005-02-22 04:00:00,53
22/02/05,5:00 am,18.2,0.96,0,0,0,2005-02-22 05:00:00,53
22/02/05,6:00 am,18.1,0.96,0,0,0,2005-02-22 06:00:00,53
22/02/05,7:00 am,19.1,0.96,0,0,0.17208,2005-02-22 07:00:00,53
22/02/05,8:00 am,20.1,0.96,0,0.025,7.48548,2005-02-22 08:00:00,53
22/02/05,9:00 am,21.6,0.96,0,0,11.87352,2005-02-22 09:00:00,53
22/02/05,10:00 am,23.4,0.95,0,0,30.114,2005-02-22 10:00:00,53
22/02/05,11:00 am,25.5,0.83,0,0,32.95332,2005-02-22 11:00:00,53
22/02/05,12:00 pm,27.2,0.73,0,0,49.81716,2005-02-22 12:00:00,53
22/02/05,1:00 pm,29.8,0.64,0,0,83.0286,2005-02-22 13:00:00,53
22/02/05,2:00 pm,30.9,0.66,0,0,85.35168,2005-02-22 14:00:00,53
22/02/05,3:00 pm,31.7,0.55,0,0,83.54484,2005-02-22 15:00:00,53
22/02/05,4:00 pm,31.3,0.72,0,0,56.87244,2005-02-22 16:00:00,53
22/02/05,5:00 pm,30.3,0.72,1.6,0,51.71004,2005-02-22 17:00:00,53
22/02/05,6:00 pm,29.9,0.72,0,0,38.02968,2005-02-22 18:00:00,53
22/02/05,7:00 pm,28.9,0.71,0,0,16.26156,2005-02-22 19:00:00,53
22/02/05,8:00 pm,25.6,0.8,0,0,2.151,2005-02-22 20:00:00,53
22/02/05,9:00 pm,23.3,0.85,0,0,0,2005-02-22 21:00:00,53
22/02/05,10:00 pm,22.2,0.87,0,0,0,2005-02-22 22:00:00,53
22/02/05,11:00 pm,21.6,0.89,0,0,0,2005-02-22 23:00:00,53
23/02/05,12:00 am,21.1,0.9,0,0,0,2005-02-23 00:00:00,54
23/02/05,1:00 am,21,0.89,0,0,0,2005-02-23 01:00:00,54
23/02/05,2:00 am,20.8,0.92,0,0,0,2005-02-23 02:00:00,54
23/02/05,3:00 am,20.6,0.92,0,0,0,2005-02-23 03:00:00,54
23/02/05,4:00 am,19.9,0.92,0,0,0,2005-02-23 04:00:00,54
23/02/05,5:00 am,18.8,0.94,0,0,0,2005-02-23 05:00:00,54
23/02/05,6:00 am,17.9,0.94,0,0,0,2005-02-23 06:00:00,54
23/02/05,7:00 am,17.6,0.95,0,0,0.08604,2005-02-23 07:00:00,54
23/02/05,8:00 am,19.4,0.94,0,0,9.98064,2005-02-23 08:00:00,54
23/02/05,9:00 am,23.9,0.86,0,0,20.30544,2005-02-23 09:00:00,54
23/02/05,10:00 am,25.9,0.83,0,0,25.812,2005-02-23 10:00:00,54
23/02/05,11:00 am,26.6,0.81,0,0,24.00516,2005-02-23 11:00:00,54
23/02/05,12:00 pm,27.2,0.78,0,0,20.47752,2005-02-23 12:00:00,54
23/02/05,1:00 pm,27.1,0.81,0,0,18.15444,2005-02-23 13:00:00,54
23/02/05,2:00 pm,27.7,0.8,0,0,19.27296,2005-02-23 14:00:00,54
23/02/05,3:00 pm,27.7,0.77,0,0,18.58464,2005-02-23 15:00:00,54
23/02/05,4:00 pm,27.8,0.75,0,0,26.58636,2005-02-23 16:00:00,54
23/02/05,5:00 pm,27.8,0.76,0,0,26.58636,2005-02-23 17:00:00,54
23/02/05,6:00 pm,27,0.81,0,0,14.45472,2005-02-23 18:00:00,54
23/02/05,7:00 pm,26.5,0.83,0,0,5.5926,2005-02-23 19:00:00,54
23/02/05,8:00 pm,25.1,0.87,0,0,0.4302,2005-02-23 20:00:00,54
23/02/05,9:00 pm,24.3,0.89,0,0,0,2005-02-23 21:00:00,54
23/02/05,10:00 pm,23.7,0.89,0,0,0,2005-02-23 22:00:00,54
23/02/05,11:00 pm,23.4,0.89,0,0,0,2005-02-23 23:00:00,54
24/02/05,12:00 am,23.2,0.91,0,0,0,2005-02-24 00:00:00,55
24/02/05,1:00 am,23.1,0.91,0,0,0,2005-02-24 01:00:00,55
24/02/05,2:00 am,22.6,0.94,0,0,0,2005-02-24 02:00:00,55
24/02/05,3:00 am,22.6,0.93,0,0,0,2005-02-24 03:00:00,55
24/02/05,4:00 am,22.3,0.94,0,0,0,2005-02-24 04:00:00,55
24/02/05,5:00 am,22.3,0.94,0,0,0,2005-02-24 05:00:00,55
24/02/05,6:00 am,22.8,0.92,0,0,0,2005-02-24 06:00:00,55
24/02/05,7:00 am,22.7,0.93,0,0,0,2005-02-24 07:00:00,55
24/02/05,8:00 am,22.7,0.94,0,0,1.11852,2005-02-24 08:00:00,55
24/02/05,9:00 am,23.8,0.9,0,0,7.14132,2005-02-24 09:00:00,55
24/02/05,10:00 am,24.9,0.84,0,0,16.3476,2005-02-24 10:00:00,55
24/02/05,11:00 am,27.2,0.75,0,0,33.38352,2005-02-24 11:00:00,55
24/02/05,12:00 pm,28.8,0.65,0,0,46.20348,2005-02-24 12:00:00,55
24/02/05,1:00 pm,28.6,0.61,1.6,0,42.07356,2005-02-24 13:00:00,55
24/02/05,2:00 pm,29.8,0.63,0,0,55.75392,2005-02-24 14:00:00,55
24/02/05,3:00 pm,31.7,0.53,0,0,83.97504,2005-02-24 15:00:00,55
24/02/05,4:00 pm,31.6,0.65,0,0,53.86104,2005-02-24 16:00:00,55
24/02/05,5:00 pm,30.6,0.64,0,0,34.76016,2005-02-24 17:00:00,55
24/02/05,6:00 pm,29.9,0.69,0,0,32.95332,2005-02-24 18:00:00,55
24/02/05,7:00 pm,29.5,0.72,0,0,18.84276,2005-02-24 19:00:00,55
24/02/05,8:00 pm,26.9,0.83,0,0,1.97892,2005-02-24 20:00:00,55
24/02/05,9:00 pm,25,0.89,0,0,0,2005-02-24 21:00:00,55
24/02/05,10:00 pm,24.4,0.91,0,0,0,2005-02-24 22:00:00,55
24/02/05,11:00 pm,24.4,0.91,0,0,0,2005-02-24 23:00:00,55
25/02/05,12:00 am,23.5,0.92,0,0,0,2005-02-25 00:00:00,56
25/02/05,1:00 am,22.7,0.93,0,0,0,2005-02-25 01:00:00,56
25/02/05,2:00 am,22.8,0.9,0,0,0,2005-02-25 02:00:00,56
25/02/05,3:00 am,22.8,0.92,0,0,0,2005-02-25 03:00:00,56
25/02/05,4:00 am,22.7,0.92,0,0,0,2005-02-25 04:00:00,56
25/02/05,5:00 am,22.6,0.92,0,0,0,2005-02-25 05:00:00,56
25/02/05,6:00 am,22.3,0.93,0,0,0,2005-02-25 06:00:00,56
25/02/05,7:00 am,22.3,0.92,0,0,0,2005-02-25 07:00:00,56
25/02/05,8:00 am,22.4,0.93,0,0,2.151,2005-02-25 08:00:00,56
25/02/05,9:00 am,23.3,0.89,0,0,10.41084,2005-02-25 09:00:00,56
25/02/05,10:00 am,24.5,0.86,4.8,0,17.6382,2005-02-25 10:00:00,56
25/02/05,11:00 am,26.7,0.78,6.4,0,56.7864,2005-02-25 11:00:00,56
25/02/05,12:00 pm,28.3,0.74,6.4,0,68.65992,2005-02-25 12:00:00,56
25/02/05,1:00 pm,28.6,0.71,9.7,0,46.63368,2005-02-25 13:00:00,56
25/02/05,2:00 pm,29.1,0.65,9.7,0,74.76876,2005-02-25 14:00:00,56
25/02/05,3:00 pm,29.9,0.63,9.7,0,80.0172,2005-02-25 15:00:00,56
25/02/05,4:00 pm,30.2,0.66,9.7,0,75.02688,2005-02-25 16:00:00,56
25/02/05,5:00 pm,29,0.74,12.9,0,46.63368,2005-02-25 17:00:00,56
25/02/05,6:00 pm,27.4,0.71,9.7,0,28.73736,2005-02-25 18:00:00,56
25/02/05,7:00 pm,27.3,0.79,8,0,18.58464,2005-02-25 19:00:00,56
25/02/05,8:00 pm,25.1,0.85,3.2,0,2.06496,2005-02-25 20:00:00,56
25/02/05,9:00 pm,22.8,0.88,0,0,0,2005-02-25 21:00:00,56
25/02/05,10:00 pm,21.2,0.9,0,0,0,2005-02-25 22:00:00,56
25/02/05,11:00 pm,20.3,0.92,0,0,0,2005-02-25 23:00:00,56
26/02/05,12:00 am,18.9,0.93,0,0,0,2005-02-26 00:00:00,57
26/02/05,1:00 am,18.1,0.95,0,0,0,2005-02-26 01:00:00,57
26/02/05,2:00 am,17.8,0.96,0,0,0,2005-02-26 02:00:00,57
26/02/05,3:00 am,17.6,0.96,0,0,0,2005-02-26 03:00:00,57
26/02/05,4:00 am,16.9,0.96,0,0,0,2005-02-26 04:00:00,57
26/02/05,5:00 am,16.8,0.96,0,0,0,2005-02-26 05:00:00,57
26/02/05,6:00 am,16.4,0.96,0,0,0,2005-02-26 06:00:00,57
26/02/05,7:00 am,16.2,0.96,0,0,0.08604,2005-02-26 07:00:00,57
26/02/05,8:00 am,17,0.96,0,0,5.67864,2005-02-26 08:00:00,57
26/02/05,9:00 am,21,0.96,1.6,0,23.2308,2005-02-26 09:00:00,57
26/02/05,10:00 am,24.4,0.8,3.2,0,42.84792,2005-02-26 10:00:00,57
26/02/05,11:00 am,27.4,0.61,1.6,0,59.19552,2005-02-26 11:00:00,57
26/02/05,12:00 pm,29.7,0.65,1.6,0,71.92944,2005-02-26 12:00:00,57
26/02/05,1:00 pm,30.4,0.6,3.2,0,78.7266,2005-02-26 13:00:00,57
26/02/05,2:00 pm,30.9,0.57,4.8,0,80.61948,2005-02-26 14:00:00,57
26/02/05,3:00 pm,31.7,0.54,3.2,0,77.69412,2005-02-26 15:00:00,57
26/02/05,4:00 pm,32.4,0.45,1.6,0,58.42116,2005-02-26 16:00:00,57
26/02/05,5:00 pm,32.3,0.64,1.6,0,40.4388,2005-02-26 17:00:00,57
26/02/05,6:00 pm,32.2,0.62,3.2,0,37.59948,2005-02-26 18:00:00,57
26/02/05,7:00 pm,29.5,0.71,1.6,0,17.208,2005-02-26 19:00:00,57
26/02/05,8:00 pm,26,0.82,1.6,0,2.66724,2005-02-26 20:00:00,57
26/02/05,9:00 pm,23.1,0.86,0,0,0,2005-02-26 21:00:00,57
26/02/05,10:00 pm,21.4,0.89,0,0,0,2005-02-26 22:00:00,57
26/02/05,11:00 pm,20.9,0.92,0,0,0,2005-02-26 23:00:00,57
27/02/05,12:00 am,21.1,0.92,1.6,0,0,2005-02-27 00:00:00,58
27/02/05,1:00 am,20.8,0.91,0,0,0,2005-02-27 01:00:00,58
27/02/05,2:00 am,19.9,0.93,0,0,0,2005-02-27 02:00:00,58
27/02/05,3:00 am,19.4,0.92,0,0,0,2005-02-27 03:00:00,58
27/02/05,4:00 am,18.9,0.94,0,0,0,2005-02-27 04:00:00,58
27/02/05,5:00 am,18.6,0.95,0,0,0,2005-02-27 05:00:00,58
27/02/05,6:00 am,19.4,0.95,0,0,0,2005-02-27 06:00:00,58
27/02/05,7:00 am,18.8,0.95,0,0,0.08604,2005-02-27 07:00:00,58
27/02/05,8:00 am,20.3,0.91,3.2,0,7.05528,2005-02-27 08:00:00,58
27/02/05,9:00 am,24.3,0.78,4.8,0,23.661,2005-02-27 09:00:00,58
27/02/05,10:00 am,26.8,0.72,6.4,0,42.24564,2005-02-27 10:00:00,58
27/02/05,11:00 am,28.8,0.68,4.8,0,58.59324,2005-02-27 11:00:00,58
27/02/05,12:00 pm,30.2,0.65,4.8,0,70.72488,2005-02-27 12:00:00,58
27/02/05,1:00 pm,31.3,0.51,3.2,0,77.95224,2005-02-27 13:00:00,58
27/02/05,2:00 pm,32.7,0.55,3.2,0,80.27532,2005-02-27 14:00:00,58
27/02/05,3:00 pm,33.1,0.49,3.2,0,76.74768,2005-02-27 15:00:00,58
27/02/05,4:00 pm,33.8,0.49,3.2,0,66.76704,2005-02-27 16:00:00,58
27/02/05,5:00 pm,33.9,0.45,1.6,0,49.64508,2005-02-27 17:00:00,58
27/02/05,6:00 pm,33.8,0.58,1.6,0,35.44848,2005-02-27 18:00:00,58
27/02/05,7:00 pm,31.2,0.69,1.6,0,16.08948,2005-02-27 19:00:00,58
27/02/05,8:00 pm,27.6,0.75,3.2,0,2.49516,2005-02-27 20:00:00,58
27/02/05,9:00 pm,26.2,0.78,6.4,0,0,2005-02-27 21:00:00,58
27/02/05,10:00 pm,24.1,0.86,3.2,0,0,2005-02-27 22:00:00,58
27/02/05,11:00 pm,23.3,0.87,3.2,0,0,2005-02-27 23:00:00,58
28/02/05,12:00 am,23.8,0.84,4.8,0,0,2005-02-28 00:00:00,59
28/02/05,1:00 am,23.4,0.85,6.4,0,0,2005-02-28 01:00:00,59
28/02/05,2:00 am,22.7,0.9,3.2,0,0,2005-02-28 02:00:00,59
28/02/05,3:00 am,21.4,0.88,19.3,0.102,0,2005-02-28 03:00:00,59
28/02/05,4:00 am,19.9,0.89,14.5,0,0,2005-02-28 04:00:00,59
28/02/05,5:00 am,20.1,0.87,9.7,0,0,2005-02-28 05:00:00,59
28/02/05,6:00 am,19.7,0.91,4.8,0,0,2005-02-28 06:00:00,59
28/02/05,7:00 am,18.1,0.92,1.6,0,0.08604,2005-02-28 07:00:00,59
28/02/05,8:00 am,18,0.9,1.6,0,7.57152,2005-02-28 08:00:00,59
28/02/05,9:00 am,21.2,0.84,11.3,0,26.58636,2005-02-28 09:00:00,59
28/02/05,10:00 am,23.2,0.77,11.3,0,38.20176,2005-02-28 10:00:00,59
28/02/05,11:00 am,24.7,0.78,8,0,42.76188,2005-02-28 11:00:00,59
28/02/05,12:00 pm,26,0.76,8,0.025,50.93568,2005-02-28 12:00:00,59
28/02/05,1:00 pm,26.8,0.7,8,0,58.077,2005-02-28 13:00:00,59
28/02/05,2:00 pm,27.7,0.69,11.3,0,67.88556,2005-02-28 14:00:00,59
28/02/05,3:00 pm,27.3,0.72,12.9,0,53.3448,2005-02-28 15:00:00,59
28/02/05,4:00 pm,26.6,0.73,16.1,0,54.72144,2005-02-28 16:00:00,59
28/02/05,5:00 pm,25.6,0.76,16.1,0,48.95676,2005-02-28 17:00:00,59
28/02/05,6:00 pm,24.1,0.75,17.7,0,31.23252,2005-02-28 18:00:00,59
28/02/05,7:00 pm,23.2,0.77,16.1,0,16.26156,2005-02-28 19:00:00,59
28/02/05,8:00 pm,21.7,0.83,12.9,0,2.66724,2005-02-28 20:00:00,59
28/02/05,9:00 pm,20.6,0.86,11.3,0,0,2005-02-28 21:00:00,59
28/02/05,10:00 pm,20.1,0.85,11.3,0,0,2005-02-28 22:00:00,59
28/02/05,11:00 pm,20,0.86,11.3,0,0,2005-02-28 23:00:00,59
01/03/05,12:00 am,19.1,0.87,8,0,0,2005-03-01 00:00:00,60
01/03/05,1:00 am,18.6,0.87,6.4,0,0,2005-03-01 01:00:00,60
01/03/05,2:00 am,18,0.86,6.4,0,0,2005-03-01 02:00:00,60
01/03/05,3:00 am,17,0.86,6.4,0,0,2005-03-01 03:00:00,60
01/03/05,4:00 am,16.3,0.84,8,0,0,2005-03-01 04:00:00,60
01/03/05,5:00 am,15.5,0.84,6.4,0,0,2005-03-01 05:00:00,60
01/03/05,6:00 am,15.1,0.85,8,0,0,2005-03-01 06:00:00,60
01/03/05,7:00 am,14.6,0.86,6.4,0,0.08604,2005-03-01 07:00:00,60
01/03/05,8:00 am,14.6,0.81,8,0,6.0228,2005-03-01 08:00:00,60
01/03/05,9:00 am,16.5,0.72,9.7,0,23.05872,2005-03-01 09:00:00,60
01/03/05,10:00 am,18.2,0.66,14.5,0,42.1596,2005-03-01 10:00:00,60
01/03/05,11:00 am,19.8,0.64,12.9,0,58.42116,2005-03-01 11:00:00,60
01/03/05,12:00 pm,21.3,0.55,11.3,0,71.4132,2005-03-01 12:00:00,60
01/03/05,1:00 pm,22.2,0.54,9.7,0,75.97332,2005-03-01 13:00:00,60
01/03/05,2:00 pm,23.2,0.55,9.7,0,81.04968,2005-03-01 14:00:00,60
01/03/05,3:00 pm,24.1,0.51,9.7,0,76.05936,2005-03-01 15:00:00,60
01/03/05,4:00 pm,24.4,0.51,9.7,0,66.93912,2005-03-01 16:00:00,60
01/03/05,5:00 pm,24.4,0.53,8,0,52.9146,2005-03-01 17:00:00,60
01/03/05,6:00 pm,23.9,0.56,8,0,35.10432,2005-03-01 18:00:00,60
01/03/05,7:00 pm,22.6,0.62,6.4,0,16.51968,2005-03-01 19:00:00,60
01/03/05,8:00 pm,19.3,0.81,3.2,0,1.46268,2005-03-01 20:00:00,60
01/03/05,9:00 pm,16.8,0.85,1.6,0,0,2005-03-01 21:00:00,60
01/03/05,10:00 pm,16.2,0.83,1.6,0,0,2005-03-01 22:00:00,60
01/03/05,11:00 pm,16.3,0.82,3.2,0,0,2005-03-01 23:00:00,60
02/03/05,12:00 am,15.5,0.84,3.2,0,0,2005-03-02 00:00:00,61
02/03/05,1:00 am,15.1,0.88,1.6,0,0,2005-03-02 01:00:00,61
02/03/05,2:00 am,15.2,0.84,1.6,0,0,2005-03-02 02:00:00,61
02/03/05,3:00 am,16.2,0.85,3.2,0,0,2005-03-02 03:00:00,61
02/03/05,4:00 am,15.7,0.84,3.2,0,0,2005-03-02 04:00:00,61
02/03/05,5:00 am,15.7,0.84,3.2,0,0,2005-03-02 05:00:00,61
02/03/05,6:00 am,15.8,0.85,3.2,0,0,2005-03-02 06:00:00,61
02/03/05,7:00 am,15.8,0.86,1.6,0,0,2005-03-02 07:00:00,61
02/03/05,8:00 am,15.8,0.82,1.6,0,5.07636,2005-03-02 08:00:00,61
02/03/05,9:00 am,17.8,0.75,6.4,0,15.14304,2005-03-02 09:00:00,61
02/03/05,10:00 am,19.4,0.7,8,0,29.42568,2005-03-02 10:00:00,61
02/03/05,11:00 am,20.3,0.84,6.4,0,17.29404,2005-03-02 11:00:00,61
02/03/05,12:00 pm,19.8,0.74,3.2,0,24.9516,2005-03-02 12:00:00,61
02/03/05,1:00 pm,23.3,0.56,6.4,0,55.40976,2005-03-02 13:00:00,61
02/03/05,2:00 pm,24.7,0.51,8,0,70.63884,2005-03-02 14:00:00,61
02/03/05,3:00 pm,25.8,0.51,8,0,71.49924,2005-03-02 15:00:00,61
02/03/05,4:00 pm,26.3,0.46,8,0,61.77672,2005-03-02 16:00:00,61
02/03/05,5:00 pm,26.6,0.52,8,0,52.14024,2005-03-02 17:00:00,61
02/03/05,6:00 pm,26.2,0.51,8,0,34.93224,2005-03-02 18:00:00,61
02/03/05,7:00 pm,24.7,0.66,3.2,0,16.86384,2005-03-02 19:00:00,61
02/03/05,8:00 pm,21.7,0.74,1.6,0,2.40912,2005-03-02 20:00:00,61
02/03/05,9:00 pm,18.1,0.85,0,0,0,2005-03-02 21:00:00,61
02/03/05,10:00 pm,16.6,0.86,1.6,0,0,2005-03-02 22:00:00,61
02/03/05,11:00 pm,17.1,0.83,3.2,0,0,2005-03-02 23:00:00,61
03/03/05,12:00 am,16.5,0.85,0,0,0,2005-03-03 00:00:00,62
03/03/05,1:00 am,16.4,0.88,1.6,0,0,2005-03-03 01:00:00,62
03/03/05,2:00 am,17.6,0.86,4.8,0,0,2005-03-03 02:00:00,62
03/03/05,3:00 am,16.8,0.88,3.2,0,0,2005-03-03 03:00:00,62
03/03/05,4:00 am,17,0.87,6.4,0,0,2005-03-03 04:00:00,62
03/03/05,5:00 am,15.9,0.88,4.8,0,0,2005-03-03 05:00:00,62
03/03/05,6:00 am,15.5,0.88,3.2,0,0,2005-03-03 06:00:00,62
03/03/05,7:00 am,15.8,0.87,3.2,0,0,2005-03-03 07:00:00,62
03/03/05,8:00 am,17.2,0.83,6.4,0,6.79716,2005-03-03 08:00:00,62
03/03/05,9:00 am,19.3,0.66,6.4,0,25.3818,2005-03-03 09:00:00,62
03/03/05,10:00 am,21.9,0.59,11.3,0,42.41772,2005-03-03 10:00:00,62
03/03/05,11:00 am,24.3,0.53,11.3,0,58.077,2005-03-03 11:00:00,62
03/03/05,12:00 pm,26.6,0.46,9.7,0,70.29468,2005-03-03 12:00:00,62
03/03/05,1:00 pm,28.4,0.43,8,0,77.78016,2005-03-03 13:00:00,62
03/03/05,2:00 pm,29.5,0.36,8,0,79.50096,2005-03-03 14:00:00,62
03/03/05,3:00 pm,30.3,0.37,8,0,75.54312,2005-03-03 15:00:00,62
03/03/05,4:00 pm,30.4,0.41,8,0,66.2508,2005-03-03 16:00:00,62
03/03/05,5:00 pm,30,0.42,8,0,52.39836,2005-03-03 17:00:00,62
03/03/05,6:00 pm,28.8,0.44,9.7,0,34.93224,2005-03-03 18:00:00,62
03/03/05,7:00 pm,26.4,0.56,6.4,0,16.43364,2005-03-03 19:00:00,62
03/03/05,8:00 pm,22.2,0.75,3.2,0,2.23704,2005-03-03 20:00:00,62
03/03/05,9:00 pm,18.8,0.81,1.6,0,0,2005-03-03 21:00:00,62
03/03/05,10:00 pm,18.5,0.8,3.2,0,0,2005-03-03 22:00:00,62
03/03/05,11:00 pm,18.3,0.83,3.2,0,0,2005-03-03 23:00:00,62
04/03/05,12:00 am,17.2,0.85,3.2,0,0,2005-03-04 00:00:00,63
04/03/05,1:00 am,16.7,0.89,1.6,0,0,2005-03-04 01:00:00,63
04/03/05,2:00 am,16,0.89,1.6,0,0,2005-03-04 02:00:00,63
04/03/05,3:00 am,15.3,0.89,1.6,0,0,2005-03-04 03:00:00,63
04/03/05,4:00 am,14.8,0.89,1.6,0,0,2005-03-04 04:00:00,63
04/03/05,5:00 am,15.1,0.88,3.2,0,0,2005-03-04 05:00:00,63
04/03/05,6:00 am,14.3,0.9,1.6,0,0,2005-03-04 06:00:00,63
04/03/05,7:00 am,14.5,0.88,3.2,0,0.08604,2005-03-04 07:00:00,63
04/03/05,8:00 am,15.6,0.83,3.2,0,7.3134,2005-03-04 08:00:00,63
04/03/05,9:00 am,19.4,0.7,6.4,0,23.74704,2005-03-04 09:00:00,63
04/03/05,10:00 am,22.9,0.57,9.7,0,42.1596,2005-03-04 10:00:00,63
04/03/05,11:00 am,25.7,0.52,12.9,0,58.5072,2005-03-04 11:00:00,63
04/03/05,12:00 pm,28.2,0.43,12.9,0,70.983,2005-03-04 12:00:00,63
04/03/05,1:00 pm,30,0.36,11.3,0,78.12432,2005-03-04 13:00:00,63
04/03/05,2:00 pm,31.3,0.38,9.7,0,79.84512,2005-03-04 14:00:00,63
04/03/05,3:00 pm,32.1,0.39,8,0,75.80124,2005-03-04 15:00:00,63
04/03/05,4:00 pm,32.2,0.38,8,0,66.16476,2005-03-04 16:00:00,63
04/03/05,5:00 pm,31.9,0.38,8,0,51.79608,2005-03-04 17:00:00,63
04/03/05,6:00 pm,30.9,0.41,9.7,0,34.15788,2005-03-04 18:00:00,63
04/03/05,7:00 pm,28.7,0.55,8,0,16.17552,2005-03-04 19:00:00,63
04/03/05,8:00 pm,24.3,0.74,4.8,0,2.06496,2005-03-04 20:00:00,63
04/03/05,9:00 pm,20.7,0.77,3.2,0,0,2005-03-04 21:00:00,63
04/03/05,10:00 pm,19.4,0.76,3.2,0,0,2005-03-04 22:00:00,63
04/03/05,11:00 pm,18.9,0.77,3.2,0,0,2005-03-04 23:00:00,63
05/03/05,12:00 am,19,0.81,3.2,0,0,2005-03-05 00:00:00,64
05/03/05,1:00 am,18.9,0.84,3.2,0,0,2005-03-05 01:00:00,64
05/03/05,2:00 am,19.3,0.81,3.2,0,0,2005-03-05 02:00:00,64
05/03/05,3:00 am,18.8,0.85,4.8,0,0,2005-03-05 03:00:00,64
05/03/05,4:00 am,17.7,0.87,1.6,0,0,2005-03-05 04:00:00,64
05/03/05,5:00 am,17,0.85,3.2,0,0,2005-03-05 05:00:00,64
05/03/05,6:00 am,17.9,0.85,3.2,0,0,2005-03-05 06:00:00,64
05/03/05,7:00 am,17.3,0.85,3.2,0,0,2005-03-05 07:00:00,64
05/03/05,8:00 am,18.2,0.81,3.2,0,5.5926,2005-03-05 08:00:00,64
05/03/05,9:00 am,21.6,0.71,4.8,0,22.3704,2005-03-05 09:00:00,64
05/03/05,10:00 am,25.4,0.58,6.4,0,41.12712,2005-03-05 10:00:00,64
05/03/05,11:00 am,28.6,0.49,6.4,0,57.56076,2005-03-05 11:00:00,64
05/03/05,12:00 pm,31.1,0.41,6.4,0,70.1226,2005-03-05 12:00:00,64
05/03/05,1:00 pm,32.7,0.35,3.2,0,77.34996,2005-03-05 13:00:00,64
05/03/05,2:00 pm,33.9,0.36,1.6,0,79.32888,2005-03-05 14:00:00,64
05/03/05,3:00 pm,34.6,0.33,3.2,0,75.285,2005-03-05 15:00:00,64
05/03/05,4:00 pm,34.9,0.34,1.6,0,65.3904,2005-03-05 16:00:00,64
05/03/05,5:00 pm,34.8,0.31,1.6,0,51.10776,2005-03-05 17:00:00,64
05/03/05,6:00 pm,33.6,0.42,3.2,0,33.46956,2005-03-05 18:00:00,64
05/03/05,7:00 pm,30.6,0.52,4.8,0,14.97096,2005-03-05 19:00:00,64
05/03/05,8:00 pm,26.9,0.64,8,0,1.63476,2005-03-05 20:00:00,64
05/03/05,9:00 pm,25.2,0.69,6.4,0,0,2005-03-05 21:00:00,64
05/03/05,10:00 pm,24.2,0.71,6.4,0,0,2005-03-05 22:00:00,64
05/03/05,11:00 pm,23,0.73,3.2,0,0,2005-03-05 23:00:00,64
06/03/05,12:00 am,21.3,0.75,3.2,0,0,2005-03-06 00:00:00,65
06/03/05,1:00 am,20.6,0.78,3.2,0,0,2005-03-06 01:00:00,65
06/03/05,2:00 am,20.4,0.85,3.2,0,0,2005-03-06 02:00:00,65
06/03/05,3:00 am,19.1,0.85,0,0,0,2005-03-06 03:00:00,65
06/03/05,4:00 am,18.4,0.88,0,0,0,2005-03-06 04:00:00,65
06/03/05,5:00 am,18.2,0.86,1.6,0,0,2005-03-06 05:00:00,65
06/03/05,6:00 am,19.4,0.88,3.2,0,0,2005-03-06 06:00:00,65
06/03/05,7:00 am,18.6,0.89,3.2,0,0,2005-03-06 07:00:00,65
06/03/05,8:00 am,19.3,0.85,3.2,0,3.8718,2005-03-06 08:00:00,65
06/03/05,9:00 am,22.6,0.74,3.2,0,16.43364,2005-03-06 09:00:00,65
06/03/05,10:00 am,26.7,0.6,9.7,0,37.59948,2005-03-06 10:00:00,65
06/03/05,11:00 am,29.9,0.54,11.3,0,55.4958,2005-03-06 11:00:00,65
06/03/05,12:00 pm,32.2,0.45,14.5,0,60.48612,2005-03-06 12:00:00,65
06/03/05,1:00 pm,34.6,0.42,14.5,0,73.47816,2005-03-06 13:00:00,65
06/03/05,2:00 pm,35.7,0.37,12.9,0,73.82232,2005-03-06 14:00:00,65
06/03/05,3:00 pm,36.4,0.39,14.5,0,70.81092,2005-03-06 15:00:00,65
06/03/05,4:00 pm,36.1,0.39,12.9,0,58.67928,2005-03-06 16:00:00,65
06/03/05,5:00 pm,35.1,0.42,11.3,0,35.01828,2005-03-06 17:00:00,65
06/03/05,6:00 pm,34.6,0.47,11.3,0,28.3932,2005-03-06 18:00:00,65
06/03/05,7:00 pm,32.2,0.6,6.4,0,10.84104,2005-03-06 19:00:00,65
06/03/05,8:00 pm,29.9,0.65,6.4,0,1.54872,2005-03-06 20:00:00,65
06/03/05,9:00 pm,27.8,0.61,6.4,0,0,2005-03-06 21:00:00,65
06/03/05,10:00 pm,27.9,0.58,11.3,0,0,2005-03-06 22:00:00,65
06/03/05,11:00 pm,27.6,0.6,11.3,0,0,2005-03-06 23:00:00,65
07/03/05,12:00 am,26.4,0.63,11.3,0,0,2005-03-07 00:00:00,66
07/03/05,1:00 am,25.1,0.72,9.7,0,0,2005-03-07 01:00:00,66
07/03/05,2:00 am,23.9,0.66,8,0,0,2005-03-07 02:00:00,66
07/03/05,3:00 am,24.1,0.68,8,0,0,2005-03-07 03:00:00,66
07/03/05,4:00 am,23.8,0.64,8,0,0,2005-03-07 04:00:00,66
07/03/05,5:00 am,24.1,0.63,9.7,0,0,2005-03-07 05:00:00,66
07/03/05,6:00 am,23.2,0.67,9.7,0,0,2005-03-07 06:00:00,66
07/03/05,7:00 am,22.1,0.71,6.4,0,0,2005-03-07 07:00:00,66
07/03/05,8:00 am,21.9,0.68,8,0,4.47408,2005-03-07 08:00:00,66
07/03/05,9:00 am,24.7,0.56,11.3,0,19.96128,2005-03-07 09:00:00,66
07/03/05,10:00 am,28.1,0.46,14.5,0,36.91116,2005-03-07 10:00:00,66
07/03/05,11:00 am,31.2,0.46,16.1,0,53.68896,2005-03-07 11:00:00,66
